{
  "content": [
    {
      "type": "text",
      "text": "# Opinion polling for the 2017 French presidential election\n\nThis page lists public opinion polls conducted for the 2017 French presidential election, which was held on 23 April 2017 with a run-off on 7 May 2017.\nUnless otherwise noted, all polls listed below are compliant with the regulations of the national polling commission (Commission nationale des sondages) and utilize the quota method.\nFirst round\nIfop-Fiducial and OpinionWay polls listed in the tables below starting in February 2017 are \"rolling\" polls unless otherwise denoted by an asterisk (*). The poll by Belgian pollster Dedicated Research commissioned by La Libre Belgique and RTBF and published on 20 February 2017, marked with two asterisks (**) in the table below, was not subject to French regulations.\nPolls marked with three asterisks (***) from Scan Research/Le Terrain use CATI and random number dialing, unlike all other pollsters, which conduct online surveys using the quota method. The polling commission published notices for each of the two polls conducted by Scan Research/Le Terrain.\nAlain Juppé, who lost the primary of the right and centre to Fillon, was floated to replace him as a result of the Fillon affair (Penelopegate). Though tested in some hypothetical polls, Juppé announced on 6 March that he would not be a candidate, regardless of what happened with Fillon.\nGraphical summary\nThe averages in the graphs below were constructed using polls listed below conducted by the eight major French pollsters. The graphs are smoothed 14-day weighted moving averages, using only the most recent poll conducted by any given pollster within that range (each poll weighted based on recency).\nFrançois Bayrou of the Democratic Movement (MoDem) renounced a potential candidacy on 22 February 2017 and instead proposed an alliance with Emmanuel Macron, which he accepted. Yannick Jadot of Europe Ecology – The Greens (EELV) announced that he would withdraw his candidacy and endorsed Benoît Hamon on 23 February after negotiating a common platform with the Socialist nominee; the agreement was approved by the EELV primary voters on 26 February.\nOfficial campaign\nThis table below lists polls completed since the publication of the official list of candidates on 18 March until the first round vote on 23 April 2017. The publication of first-round polls was prohibited after midnight on 21 April 2017.\n{| class=\"wikitable sortable\" style=\"text-align:center;font-size:90%;line-height:14px;\"\n|- style=\"height:40px;\"\n! style=\"width:100px;\" rowspan=\"2\"| Polling firm\n! style=\"width:110px;\" rowspan=\"2\"| Fieldwork date\n! style=\"width:35px;\" rowspan=\"2\"| Samplesize\n! style=\"width:30px;\" rowspan=\"2\"|\n! class=\"unsortable\" style=\"width:60px;\"| Arthaud\n! class=\"unsortable\" style=\"width:60px;\"| Poutou\n! class=\"unsortable\" style=\"width:60px;\"| Mélenchon\n! class=\"unsortable\" style=\"width:60px;\"| Hamon\n! class=\"unsortable\" style=\"width:60px;\"| Macron\n! class=\"unsortable\" style=\"width:60px;\"| Lassalle\n! class=\"unsortable\" style=\"width:60px;\"| Fillon\n! class=\"unsortable\" style=\"width:60px;\"| Dupont-Aignan\n! class=\"unsortable\" style=\"width:60px;\"| Asselineau\n! class=\"unsortable\" style=\"width:60px;\"| Le Pen\n! class=\"unsortable\" style=\"width:60px;\"| Cheminade\n|-\n! style=\"background:;\"|\n! style=\"background:;\"|\n! style=\"background:;\"|\n! style=\"background:;\"|\n! style=\"background:;\"|\n! style=\"background:;\"|\n! style=\"background:;\"|\n! style=\"background:;\"|\n! style=\"background:;\"|\n! style=\"background:;\"|\n! style=\"background:;\"|\n|- style=\"background:#E9E9E9;\"\n| 2017 election\n| data-sort-value=\"2017-04-23\"| 23 Apr 2017\n| –\n| 22.23%\n| 0.64%\n| 1.09%\n| 19.58%\n| 6.36%\n| style=\"background:#FFED99;\"| 24.01%\n| 1.21%\n| 20.01%\n| 4.70%\n| 0.92%\n| style=\"background:#E0E5F0;\"| 21.30%\n| 0.18%\n|-\n| style=\"background:#FFCCFF;\"| [http://www.odoxa.fr/wp-content/uploads/2017/04/Intention-de-vote-presidentielle-Odoxa-LePoint_210417.pdf Odoxa]\n| data-sort-value=\"2017-04-21\"| 21 Apr 2017\n| 666\n| –\n| 0%\n| 1%\n| 19%\n| 7.5%\n| style=\"background:#FFED99;\"| 24.5%\n| 0.5%\n| 19%\n| 4.5%\n| 1%\n| style=\"background:#E0E5F0;\"| 23%\n| 0%\n|-\n| style=\"background:#FFDFCC;\"| [https://web.archive.org/web/20170422133150/https://staticswww.bva-group.com/wp-content/uploads/2017/04/Intentions-de-vote-Vague-19-POP2017-21-avril-2017-Pr%C3%A9sentation.pdf BVA]\n| data-sort-value=\"2017-04-21\"| 20–21 Apr 2017\n| 1,134\n| 20%\n| 0.5%\n| 1.5%\n| 19.5%\n| 8%\n| style=\"background:#FFED99;\"| 23%\n| 1%\n| 19%\n| 4%\n| 0.5%\n| style=\"background:#C1CCE1;\"| 23%\n| data-sort-value=\"0%\"| size\n! style=\"width:30px;\" rowspan=\"2\"|\n! class=\"unsortable\" style=\"width:60px;\"| Arthaud\n! class=\"unsortable\" style=\"width:60px;\"| Poutou\n! class=\"unsortable\" style=\"width:60px;\"| Mélenchon\n! class=\"unsortable\" style=\"width:60px;\"| Jadot\n! class=\"unsortable\" style=\"width:60px;\"| Hamon\n! class=\"unsortable\" style=\"width:60px;\"| Macron\n! class=\"unsortable\" style=\"width:60px;\"| Bayrou\n! class=\"unsortable\" style=\"width:60px;\"| Lassalle\n! class=\"unsortable\" style=\"width:60px;\"| Fillon\n! class=\"unsortable\" style=\"width:60px;\"| Juppé\n! class=\"unsortable\" style=\"width:60px;\"| Dupont-Aignan\n! class=\"unsortable\" style=\"width:60px;\"| Asselineau\n! class=\"unsortable\" style=\"width:60px;\"| Le Pen\n! class=\"unsortable\" style=\"width:60px;\"| Cheminade\n|-\n! style=\"background:;\"|\n! style=\"background:;\"|\n! style=\"background:;\"|\n! style=\"background:;\"|\n! style=\"background:;\"|\n! style=\"background:;\"|\n! style=\"background:;\"|\n! style=\"background:;\"|\n! style=\"background:;\"|\n! style=\"background:;\"|\n! style=\"background:;\"|\n! style=\"background:;\"|\n! style=\"background:;\"|\n! style=\"background:;\"|\n|-\n| style=\"background:#FFDFCC;\"| [http://www.bva.fr/data/sondage/sondage_fiche/1962/fichier_intentions_de_vote_-_vague_13_-_pop2017_-_18_mars_2017_-_presentationd5dd0.pdf BVA]\n| data-sort-value=\"2017-03-17\"| 15–17 Mar 2017\n| 935\n| 27%\n| 1%\n| data-sort-value=\"0%\"|\n| 1.5%\n| 1%\n| 12%\n| –\n| 12%\n| style=\"background:#FFED99;\"| 26%\n| –\n| 0.5%\n| 17%\n| –\n| 3%\n| 1%\n| style=\"background:#C1CCE1;\"| 26%\n| data-sort-value=\"0%\"|\n| 1%\n| 1%\n| 11.5%\n| –\n| 14%\n| style=\"background:#FFF7CE;\"| 25%\n| –\n| –\n| 17.5%\n| –\n| 3%\n| –\n| style=\"background:#C1CCE1;\"| 27%\n| data-sort-value=\"0%\"|\n| 1%\n| 1%\n| 12%\n| –\n| 16%\n| style=\"background:#FFF7CE;\"| 25%\n| –\n| –\n| 17%\n| –\n| 2%\n| –\n| style=\"background:#C1CCE1;\"| 26%\n| data-sort-value=\"0%\"|\n| 1%\n| 0.5%\n| 10%\n| –\n| 14%\n| style=\"background:#FFF7CE;\"| 25%\n| –\n| –\n| 20%\n| –\n| 2.5%\n| –\n| style=\"background:#C1CCE1;\"| 27%\n| data-sort-value=\"0%\"|\n| 0.5%\n| 0.5%\n| 10%\n| 2%\n| 15%\n| 21%\n| –\n| –\n| style=\"background:#DFEEFF;\"| 22%\n| –\n| 3.5%\n| –\n| style=\"background:#C1CCE1;\"| 25%\n| 0.5%\n|-\n| 0.5%\n| 0.5%\n| 10%\n| 2%\n| 13%\n| 20%\n| 5%\n| –\n| style=\"background:#DFEEFF;\"| 21%\n| –\n| 3%\n| –\n| style=\"background:#C1CCE1;\"| 25%\n| data-sort-value=\"0%\"| size\n! class=\"unsortable\" style=\"width:60px;\"| Arthaud\n! class=\"unsortable\" style=\"width:60px;\"| Poutou\n! class=\"unsortable\" style=\"width:60px;\"| Mélenchon\n! class=\"unsortable\" style=\"width:60px;\"| Larrouturou\n! class=\"unsortable\" style=\"width:60px;\"| Marchandise\n! class=\"unsortable\" style=\"width:60px;\"| Hamon\n! class=\"unsortable\" style=\"width:60px;\"| Macron\n! class=\"unsortable\" style=\"width:60px;\"| Lassalle\n! class=\"unsortable\" style=\"width:60px;\"| Yade\n! class=\"unsortable\" style=\"width:60px;\"| Fillon\n! class=\"unsortable\" style=\"width:60px;\"| Alliot-Marie\n! class=\"unsortable\" style=\"width:60px;\"| Guaino\n! class=\"unsortable\" style=\"width:60px;\"| Dupont-Aignan\n! class=\"unsortable\" style=\"width:60px;\"| Asselineau\n! class=\"unsortable\" style=\"width:60px;\"| Le Pen\n! class=\"unsortable\" style=\"width:60px;\"| Cheminade\n|-\n! style=\"background:;\"|\n! style=\"background:;\"|\n! style=\"background:;\"|\n! style=\"background:;\"|\n! style=\"background:;\"|\n! style=\"background:;\"|\n! style=\"background:;\"|\n! style=\"background:;\"|\n! style=\"background:;\"|\n! style=\"background:;\"|\n! style=\"background:;\"|\n! style=\"background:;\"|\n! style=\"background:;\"|\n! style=\"background:;\"|\n! style=\"background:;\"|\n! style=\"background:;\"|\n|-\n| style=\"background:#FFCCCC;\"| [https://www.ifop.com/wp-content/uploads/2018/03/3683-1-study_file.pdf Ifop-Fiducial]\n| data-sort-value=\"2017-03-04\"| 1–4 Mar 2017\n| 1,392\n| 1%\n| 0.5%\n| 10.5%\n| data-sort-value=\"0%\"| size\n! style=\"width:30px;\" rowspan=\"2\"|\n! class=\"unsortable\" style=\"width:60px;\"| Arthaud\n! class=\"unsortable\" style=\"width:60px;\"| Poutou\n! class=\"unsortable\" style=\"width:60px;\"| Mélenchon\n! class=\"unsortable\" style=\"width:60px;\"| Jadot\n! class=\"unsortable\" style=\"width:60px;\"| Hollande\n! class=\"unsortable\" style=\"width:60px;\"| Valls\n! class=\"unsortable\" style=\"width:60px;\"| Montebourg\n! class=\"unsortable\" style=\"width:60px;\"| Hamon\n! class=\"unsortable\" style=\"width:60px;\"| Peillon\n! class=\"unsortable\" style=\"width:60px;\"| Pinel\n! class=\"unsortable\" style=\"width:60px;\"| Macron\n! class=\"unsortable\" style=\"width:60px;\"| Bayrou\n! class=\"unsortable\" style=\"width:60px;\"| Fillon\n! class=\"unsortable\" style=\"width:60px;\"| Dupont-Aignan\n! class=\"unsortable\" style=\"width:60px;\"| Le Pen\n! class=\"unsortable\" style=\"width:60px;\"| Cheminade\n|-\n! style=\"background:;\"|\n! style=\"background:;\"|\n! style=\"background:;\"|\n! style=\"background:;\"|\n! style=\"background:;\"|\n! style=\"background:;\"|\n! style=\"background:;\"|\n! style=\"background:;\"|\n! style=\"background:;\"|\n! style=\"background:;\"|\n! style=\"background:;\"|\n! style=\"background:;\"|\n! style=\"background:;\"|\n! style=\"background:;\"|\n! style=\"background:;\"|\n! style=\"background:;\"|\n|-\n| rowspan=\"3\" style=\"background:#04FBF4;\"| [https://www.ipsos.com/sites/default/files/files-fr-fr/doc_associe/notice_technique_enquete_gauche_-_ipsos_france_2_janvier_2017.pdf Ipsos]\n| rowspan=\"3\" data-sort-value=\"2017-01-20\"| 20 Jan 2017\n| rowspan=\"3\"| 992\n| rowspan=\"3\"| –\n| 1%\n| 1%\n| 15%\n| 2%\n| –\n| 9%\n| –\n| –\n| –\n| –\n| 18%\n| –\n| style=\"background:#DFEEFF;\"| 25%\n| 2%\n| style=\"background:#C1CCE1;\"| 27%\n| data-sort-value=\"0%\"|\n| 0.5%\n| 1%\n| 13%\n| 2%\n| 8.5%\n| –\n| –\n| –\n| –\n| 1%\n| 17%\n| –\n| style=\"background:#B9DAFF;\"| 30%\n| 2.5%\n| style=\"background:#E0E5F0;\"| 24%\n| 0.5%\n|-\n| 0.5%\n| 1%\n| 12%\n| 2%\n| 7.5%\n| –\n| –\n| –\n| –\n| 1%\n| 15%\n| 6%\n| style=\"background:#B9DAFF;\"| 29%\n| 2.5%\n| style=\"background:#E0E5F0;\"| 23%\n| 0.5%\n|-\n| 2%\n| 1.5%\n| 15%\n| 3%\n| 14%\n| –\n| –\n| –\n| –\n| 1%\n| –\n| –\n| style=\"background:#B9DAFF;\"| 34%\n| 3%\n| style=\"background:#E0E5F0;\"| 26%\n| 0.5%\n|-\n| 1.5%\n| 1%\n| 11.5%\n| 2.5%\n| –\n| 11%\n| –\n| –\n| –\n| 0.5%\n| 15%\n| –\n| style=\"background:#B9DAFF;\"| 29%\n| 2.5%\n| style=\"background:#E0E5F0;\"| 25%\n| 0.5%\n|-\n| 1.5%\n| 1%\n| 12%\n| 2%\n| –\n| 9.5%\n| –\n| –\n| –\n| 0.5%\n| 13%\n| 6%\n| style=\"background:#B9DAFF;\"| 28%\n| 2%\n| style=\"background:#E0E5F0;\"| 24%\n| 0.5%\n|-\n| 1%\n| 1%\n| 12.5%\n| 2%\n| –\n| –\n| 7%\n| –\n| –\n| 1%\n| 17.5%\n| –\n| style=\"background:#B9DAFF;\"| 31%\n| 2.5%\n| style=\"background:#E0E5F0;\"| 24%\n| 0.5%\n|-\n| 1%\n| 1%\n| 12%\n| 1.5%\n| –\n| –\n| 6%\n| –\n| –\n| 1%\n| 16%\n| 6%\n| style=\"background:#B9DAFF;\"| 29%\n| 2%\n| style=\"background:#E0E5F0;\"| 24%\n| 0.5%\n|-\n| rowspan=\"2\" style=\"background:GreenYellow;\"| [http://www.lcp.fr/sites/default/files/Intentions_de_vote_%28LCP-Public_Senat%29.pdf Harris Interactive]\n| rowspan=\"2\" data-sort-value=\"2016-11-27\"| 27 Nov 2016\n| rowspan=\"2\"| 6,093\n| rowspan=\"2\"| –\n| 1%\n| 1%\n| 13%\n| 3%\n| 9%\n| –\n| –\n| –\n| –\n| –\n| 14%\n| 6%\n| style=\"background:#B9DAFF;\"| 26%\n| 3%\n| style=\"background:#E0E5F0;\"| 24%\n| –\n|-\n| 1%\n| 1%\n| 15%\n| 2%\n| –\n| 9%\n| –\n| –\n| –\n| –\n| 13%\n| 7%\n| style=\"background:#B9DAFF;\"| 26%\n| 2%\n| style=\"background:#E0E5F0;\"| 24%\n| –\n|-\n| style=\"background:#FFCCFF;\"| [http://www.odoxa.fr/wp-content/uploads/2016/12/Intention-de-vote-presidentielle-Odoxa-Dentsu-France-271116.pdf Odoxa]\n| data-sort-value=\"2016-11-25\"| 25 Nov 2016\n| 844\n| –\n| 2%\n| 1%\n| 12%\n| 2%\n| 8%\n| –\n| –\n| –\n| –\n| –\n| 13%\n| 6%\n| style=\"background:#B9DAFF;\"| 32%\n| 2%\n| style=\"background:#E0E5F0;\"| 22%\n| –\n|}\n8 July to 24 November 2016\n{| class=\"wikitable sortable\" style=\"text-align:center;font-size:90%;line-height:14px;\"\n|- style=\"height:40px;\"\n! style=\"width:100px;\" rowspan=\"2\"| Polling firm\n! style=\"width:110px;\" rowspan=\"2\"| Fieldwork date\n! style=\"width:35px;\" rowspan=\"2\"| Samplesize\n! style=\"width:30px;\" rowspan=\"2\"|\n! class=\"unsortable\" style=\"width:60px;\"| Arthaud\n! class=\"unsortable\" style=\"width:60px;\"| Poutou\n! class=\"unsortable\" style=\"width:60px;\"| Mélenchon\n! class=\"unsortable\" style=\"width:60px;\"| Duflot\n! class=\"unsortable\" style=\"width:60px;\"| Jadot\n! class=\"unsortable\" style=\"width:60px;\"| Hollande\n! class=\"unsortable\" style=\"width:60px;\"| Valls\n! class=\"unsortable\" style=\"width:60px;\"| Montebourg\n! class=\"unsortable\" style=\"width:60px;\"| Macron\n! class=\"unsortable\" style=\"width:60px;\"| Bayrou\n! class=\"unsortable\" style=\"width:60px;\"| Juppé\n! class=\"unsortable\" style=\"width:60px;\"| Sarkozy\n! class=\"unsortable\" style=\"width:60px;\"| Fillon\n! class=\"unsortable\" style=\"width:60px;\"| Le Maire\n! class=\"unsortable\" style=\"width:60px;\"| NKM\n! class=\"unsortable\" style=\"width:60px;\"| Copé\n! class=\"unsortable\" style=\"width:60px;\"| Dupont-Aignan\n! class=\"unsortable\" style=\"width:60px;\"| Le Pen\n! class=\"unsortable\" style=\"width:60px;\"| Cheminade\n|-\n! style=\"background:;\"|\n! style=\"background:;\"|\n! style=\"background:;\"|\n! style=\"background:;\"|\n! style=\"background:;\"|\n! style=\"background:;\"|\n! style=\"background:;\"|\n! style=\"background:;\"|\n! style=\"background:;\"|\n! style=\"background:;\"|\n! style=\"background:;\"|\n! style=\"background:;\"|\n! style=\"background:;\"|\n! style=\"background:;\"|\n! style=\"background:;\"|\n! style=\"background:;\"|\n! style=\"background:;\"|\n! style=\"background:;\"|\n! style=\"background:;\"|\n|-\n| rowspan=\"3\" style=\"background:#FFCCCC;\"| [https://www.ifop.com/wp-content/uploads/2018/03/3562-1-study_file.pdf Ifop-Fiducial]\n| rowspan=\"3\" data-sort-value=\"2016-11-17\"| 16–17 Nov 2016\n| rowspan=\"3\"| 979\n| rowspan=\"3\"| –\n| 0.5%\n| 1.5%\n| 13%\n| –\n| 2.5%\n| 9%\n| –\n| –\n| 14%\n| –\n| style=\"background:#DFEEFF;\"| 26%\n| –\n| –\n| –\n| –\n| –\n| 3%\n| style=\"background:#C1CCE1;\"| 30%\n| 0.5%\n|-\n| 1%\n| 1.5%\n| 13%\n| –\n| 2.5%\n| 9%\n| –\n| –\n| 16%\n| 8.5%\n| –\n| style=\"background:#DFEEFF;\"| 17.5%\n| –\n| –\n| –\n| –\n| 3%\n| style=\"background:#C1CCE1;\"| 28%\n| data-sort-value=\"0%\"|\n| 1%\n| 2%\n| 14.5%\n| –\n| 2%\n| 12%\n| –\n| –\n| –\n| –\n| style=\"background:#B9DAFF;\"| 34%\n| –\n| –\n| –\n| –\n| –\n| 5%\n| style=\"background:#E0E5F0;\"| 29%\n| 0.5%\n|-\n| 1.5%\n| 1.5%\n| 15.5%\n| –\n| 2%\n| 13%\n| –\n| –\n| –\n| 11.5%\n| –\n| style=\"background:#DFEEFF;\"| 22%\n| –\n| –\n| –\n| –\n| 4.5%\n| style=\"background:#C1CCE1;\"| 28%\n| 0.5%\n|-\n| 0.5%\n| 2%\n| 13%\n| –\n| 1.5%\n| 9%\n| –\n| –\n| 14%\n| –\n| style=\"background:#B9DAFF;\"| 28%\n| –\n| –\n| –\n| –\n| –\n| 4%\n| style=\"background:#C1CCE1;\"| 28%\n| data-sort-value=\"0%\"|\n| 1%\n| 2%\n| 12.5%\n| 2.5%\n| –\n| 11%\n| –\n| –\n| –\n| –\n| style=\"background:#B9DAFF;\"| 37%\n| –\n| –\n| –\n| –\n| –\n| 5%\n| style=\"background:#E0E5F0;\"| 29%\n| –\n|-\n| 1%\n| 1.5%\n| 14%\n| 3%\n| –\n| 13%\n| –\n| –\n| –\n| 14%\n| –\n| style=\"background:#DFEEFF;\"| 22%\n| –\n| –\n| –\n| –\n| 4%\n| style=\"background:#C1CCE1;\"| 27.5%\n| –\n|-\n| 1%\n| 2%\n| 12%\n| 2%\n| –\n| 9%\n| –\n| –\n| 11%\n| –\n| style=\"background:#B9DAFF;\"| 33%\n| –\n| –\n| –\n| –\n| –\n| 4%\n| style=\"background:#E0E5F0;\"| 26%\n| –\n|-\n| 1%\n| 2%\n| 12%\n| 2.5%\n| –\n| 9.5%\n| –\n| –\n| 14%\n| 10%\n| –\n| style=\"background:#DFEEFF;\"| 20%\n| –\n| –\n| –\n| –\n| 4%\n| style=\"background:#C1CCE1;\"| 25%\n| –\n|-\n| 1%\n| 2%\n| 13%\n| 2%\n| –\n| –\n| –\n| 9%\n| –\n| –\n| style=\"background:#B9DAFF;\"| 39%\n| –\n| –\n| –\n| –\n| –\n| 5%\n| style=\"background:#E0E5F0;\"| 29%\n| –\n|-\n| 1%\n| 1%\n| 15%\n| 3%\n| –\n| –\n| –\n| 10%\n| –\n| 15%\n| –\n| style=\"background:#DFEEFF;\"| 22%\n| –\n| –\n| –\n| –\n| 5%\n| style=\"background:#C1CCE1;\"| 28%\n| –\n|-\n| style=\"background:#FFCCCC;\"| [https://www.ifop.com/wp-content/uploads/2018/03/3508-1-study_file.pdf Ifop] for DLF\n| data-sort-value=\"2016-09-28\"| 26–28 Sep 2016\n| 932\n| –\n| 1.5%\n| –\n| 12%\n| 2.5%\n| –\n| 12%\n| –\n| –\n| 12%\n| –\n| style=\"background:#DFEEFF;\"| 27%\n| –\n| –\n| –\n| –\n| –\n| 5%\n| style=\"background:#C1CCE1;\"| 28%\n| –\n|-\n| rowspan=\"8\" style=\"background:#CAD5F7;\"| [https://elabe.fr/wp-content/uploads/2016/09/22092016_les_echos_radio_classique_intentions-de-vote-presidentielles_vague_3.pdf Elabe]\n| rowspan=\"8\" data-sort-value=\"2016-09-21\"| 20–21 Sep 2016\n| rowspan=\"8\"| 922\n| rowspan=\"8\"| 44%\n| 1%\n| 1%\n| 15%\n| 3%\n| –\n| 15%\n| –\n| –\n| –\n| –\n| style=\"background:#B9DAFF;\"| 34%\n| –\n| –\n| –\n| –\n| –\n| 3%\n| style=\"background:#E0E5F0;\"| 28%\n| –\n|-\n| 1%\n| 1%\n| 14%\n| 3%\n| –\n| 16%\n| –\n| –\n| –\n| 12%\n| –\n| style=\"background:#DFEEFF;\"| 23%\n| –\n| –\n| –\n| –\n| 3%\n| style=\"background:#C1CCE1;\"| 27%\n| –\n|-\n| 1%\n| 1%\n| 13%\n| 3%\n| –\n| 12%\n| –\n| –\n| 14%\n| –\n| style=\"background:#DFEEFF;\"| 26%\n| –\n| –\n| –\n| –\n| –\n| 3%\n| style=\"background:#C1CCE1;\"| 27%\n| –\n|-\n| 0.5%\n| 0.5%\n| 15%\n| 2.5%\n| –\n| 12.5%\n| –\n| –\n| 15%\n| 8%\n| –\n| style=\"background:#DFEEFF;\"| 18%\n| –\n| –\n| –\n| –\n| 3%\n| style=\"background:#C1CCE1;\"| 25%\n| –\n|-\n| 1%\n| 1%\n| 14%\n| 2.5%\n| –\n| –\n| 9%\n| –\n| 14%\n| –\n| style=\"background:#B9DAFF;\"| 28%\n| –\n| –\n| –\n| –\n| –\n| 3.5%\n| style=\"background:#E0E5F0;\"| 27%\n| –\n|-\n| 1%\n| 1%\n| 15%\n| 2%\n| –\n| –\n| 9%\n| –\n| 15%\n| 10%\n| –\n| style=\"background:#DFEEFF;\"| 18%\n| –\n| –\n| –\n| –\n| 3%\n| style=\"background:#C1CCE1;\"| 26%\n| –\n|-\n| 1%\n| 1.5%\n| 14%\n| 2%\n| –\n| –\n| –\n| 7%\n| 16%\n| –\n| style=\"background:#B9DAFF;\"| 29.5%\n| –\n| –\n| –\n| –\n| –\n| 2%\n| style=\"background:#E0E5F0;\"| 27%\n| –\n|-\n| 0.5%\n| 1%\n| 14%\n| 2%\n| –\n| –\n| –\n| 7%\n| 18%\n| 9%\n| –\n| style=\"background:#DFEEFF;\"| 19%\n| –\n| –\n| –\n| –\n| 3%\n| style=\"background:#C1CCE1;\"| 26.5%\n| –\n|-\n| rowspan=\"4\" style=\"background:#04FBF4;\"| [https://www.ipsos.com/sites/default/files/files-fr-fr/doc_associe/rapport_ipsos_cevipof_le_monde_-_eef2017_vague_6_septembre_2016.pdf Ipsos]\n| rowspan=\"4\" data-sort-value=\"2016-09-18\"| 9–18 Sep 2016\n| rowspan=\"4\"| 12,469\n| rowspan=\"4\"| –\n| 1.5%\n| 1.5%\n| 12.5%\n| 3%\n| –\n| 12.5%\n| –\n| –\n| –\n| –\n| style=\"background:#B9DAFF;\"| 34%\n| –\n| –\n| –\n| –\n| –\n| 5%\n| style=\"background:#E0E5F0;\"| 30%\n| data-sort-value=\"0%\"|\n| 1%\n| 1%\n| 12%\n| 3%\n| –\n| 11%\n| –\n| –\n| –\n| –\n| style=\"background:#B9DAFF;\"| 36%\n| –\n| –\n| –\n| –\n| –\n| 6%\n| style=\"background:#E0E5F0;\"| 30%\n| –\n|-\n| 0.5%\n| 1%\n| 12.5%\n| 3.5%\n| –\n| 13%\n| –\n| –\n| –\n| 13%\n| –\n| style=\"background:#DFEEFF;\"| 22%\n| –\n| –\n| –\n| –\n| 5%\n| style=\"background:#C1CCE1;\"| 29.5%\n| –\n|-\n| 1%\n| 1%\n| 13%\n| 3%\n| –\n| 13%\n| –\n| –\n| –\n| 12%\n| –\n| –\n| style=\"background:#DFEEFF;\"| 18.5%\n| –\n| –\n| –\n| 5.5%\n| style=\"background:#C1CCE1;\"| 33%\n| –\n|-\n| 1%\n| 1%\n| 13%\n| 3.5%\n| –\n| 14%\n| –\n| –\n| –\n| 12.5%\n| –\n| –\n| –\n| style=\"background:#DFEEFF;\"| 16%\n| –\n| –\n| 7%\n| style=\"background:#C1CCE1;\"| 32%\n| –\n|-\n| 1%\n| 0.5%\n| 10%\n| 3%\n| –\n| 9%\n| –\n| –\n| 16.5%\n| –\n| style=\"background:#DFEEFF;\"| 26%\n| –\n| –\n| –\n| –\n| –\n| 6%\n| style=\"background:#C1CCE1;\"| 28%\n| –\n|-\n| 1%\n| 1%\n| 11%\n| 3%\n| –\n| 9%\n| –\n| –\n| 18.5%\n| 7%\n| –\n| style=\"background:#DFEEFF;\"| 19%\n| –\n| –\n| –\n| –\n| 5%\n| style=\"background:#C1CCE1;\"| 25.5%\n| –\n|-\n| 0.5%\n| 1.5%\n| 12%\n| 2%\n| –\n| –\n| –\n| 9%\n| –\n| –\n| style=\"background:#B9DAFF;\"| 38%\n| –\n| –\n| –\n| –\n| –\n| 7%\n| style=\"background:#E0E5F0;\"| 30%\n| –\n|-\n| 1%\n| 0.5%\n| 13.5%\n| 2.5%\n| –\n| –\n| –\n| 9%\n| –\n| 14%\n| –\n| style=\"background:#DFEEFF;\"| 24%\n| –\n| –\n| –\n| –\n| 6.5%\n| style=\"background:#C1CCE1;\"| 29%\n| –\n|-\n| rowspan=\"8\" style=\"background:#FFCCCC;\"| [https://www.ifop.com/wp-content/uploads/2018/03/3479-1-study_file.pdf Ifop-Fiducial]\n| rowspan=\"8\" data-sort-value=\"2016-09-07\"| 5–7 Sep 2016\n| rowspan=\"8\"| 1,903\n| rowspan=\"8\"| –\n| 1%\n| 1.5%\n| 13.5%\n| 3%\n| –\n| 14%\n| –\n| –\n| –\n| –\n| style=\"background:#B9DAFF;\"| 33%\n| –\n| –\n| –\n| –\n| –\n| 5%\n| style=\"background:#E0E5F0;\"| 29%\n| data-sort-value=\"0%\"|\n| 1.5%\n| 1.5%\n| 12%\n| 3%\n| –\n| 14%\n| –\n| –\n| –\n| –\n| style=\"background:#B9DAFF;\"| 33%\n| –\n| –\n| –\n| –\n| –\n| 6%\n| style=\"background:#E0E5F0;\"| 29%\n| data-sort-value=\"0%\"|\n| 1%\n| 1.5%\n| 13.5%\n| 2%\n| –\n| 13.5%\n| –\n| –\n| –\n| –\n| style=\"background:#B9DAFF;\"| 36%\n| –\n| –\n| –\n| –\n| –\n| 4.5%\n| style=\"background:#E0E5F0;\"| 28%\n| –\n|-\n| 1%\n| 1%\n| 13%\n| 2%\n| –\n| 13%\n| –\n| –\n| –\n| 13%\n| –\n| style=\"background:#DFEEFF;\"| 23%\n| –\n| –\n| –\n| –\n| 5%\n| style=\"background:#C1CCE1;\"| 29%\n| –\n|}\n14 January to 7 July 2016\n{| class=\"wikitable sortable\" style=\"text-align:center;font-size:90%;line-height:14px;\"\n|- style=\"height:40px;\"\n! style=\"width:100px;\" rowspan=\"2\"| Polling firm\n! style=\"width:110px;\" rowspan=\"2\"| Fieldwork date\n! style=\"width:35px;\" rowspan=\"2\"| Samplesize\n! style=\"width:30px;\" rowspan=\"2\"|\n! class=\"unsortable\" style=\"width:60px;\"| Arthaud\n! class=\"unsortable\" style=\"width:60px;\"| Poutou\n! class=\"unsortable\" style=\"width:60px;\"| Mélenchon\n! class=\"unsortable\" style=\"width:60px;\"| Duflot\n! class=\"unsortable\" style=\"width:60px;\"| Hulot\n! class=\"unsortable\" style=\"width:60px;\"| Hollande\n! class=\"unsortable\" style=\"width:60px;\"| Valls\n! class=\"unsortable\" style=\"width:60px;\"| Montebourg\n! class=\"unsortable\" style=\"width:60px;\"| Macron\n! class=\"unsortable\" style=\"width:60px;\"| Bayrou\n! class=\"unsortable\" style=\"width:60px;\"| Juppé\n! class=\"unsortable\" style=\"width:60px;\"| Sarkozy\n! class=\"unsortable\" style=\"width:60px;\"| Fillon\n! class=\"unsortable\" style=\"width:60px;\"| Le Maire\n! class=\"unsortable\" style=\"width:60px;\"| Dupont-Aignan\n! class=\"unsortable\" style=\"width:60px;\"| Asselineau\n! class=\"unsortable\" style=\"width:60px;\"| Le Pen\n! class=\"unsortable\" style=\"width:60px;\"| Cheminade\n|-\n! style=\"background:;\"|\n! style=\"background:;\"|\n! style=\"background:;\"|\n! style=\"background:;\"|\n! style=\"background:;\"|\n! style=\"background:;\"|\n! style=\"background:;\"|\n! style=\"background:;\"|\n! style=\"background:;\"|\n! style=\"background:;\"|\n! style=\"background:;\"|\n! style=\"background:;\"|\n! style=\"background:;\"|\n! style=\"background:;\"|\n! style=\"background:;\"|\n! style=\"background:;\"|\n! style=\"background:;\"|\n! style=\"background:;\"|\n|-\n| rowspan=\"8\" style=\"background:#CAD5F7;\"| [https://elabe.fr/wp-content/uploads/2016/06/22062016_LES_ECHOS_RADIO_CLASSIQUE_Intentions-de-vote-pr%C3%A9sidentielles_Vague_2_AVEC_SYNTHESE.pdf Elabe]\n| rowspan=\"8\" data-sort-value=\"2016-06-21\"| 20–21 Jun 2016\n| rowspan=\"8\"| 926\n| rowspan=\"8\"| 48%\n| 1%\n| 1%\n| 11%\n| 3%\n| –\n| 14%\n| –\n| –\n| –\n| –\n| style=\"background:#B9DAFF;\"| 39%\n| –\n| –\n| –\n| 5%\n| –\n| style=\"background:#E0E5F0;\"| 26%\n| –\n|-\n| 0.5%\n| 1%\n| 12%\n| 3.5%\n| –\n| 15%\n| –\n| –\n| –\n| 11.5%\n| –\n| style=\"background:#DFEEFF;\"| 25%\n| –\n| –\n| 4.5%\n| –\n| style=\"background:#C1CCE1;\"| 27%\n| –\n|-\n| 1%\n| 1%\n| 12%\n| 3%\n| –\n| 15%\n| –\n| –\n| –\n| 10%\n| –\n| –\n| style=\"background:#DFEEFF;\"| 24%\n| –\n| 5%\n| –\n| style=\"background:#C1CCE1;\"| 29%\n| –\n|-\n| 0.5%\n| 1%\n| 11%\n| 3.5%\n| –\n| 15%\n| –\n| –\n| –\n| 12%\n| –\n| –\n| –\n| style=\"background:#DFEEFF;\"| 22%\n| 5%\n| –\n| style=\"background:#C1CCE1;\"| 30%\n| –\n|-\n| 1%\n| 1%\n| 10%\n| –\n| 9%\n| 12%\n| –\n| –\n| –\n| –\n| style=\"background:#B9DAFF;\"| 37%\n| –\n| –\n| –\n| 4%\n| –\n| style=\"background:#E0E5F0;\"| 26%\n| –\n|-\n| 0.5%\n| 1%\n| 10%\n| –\n| 10%\n| 14%\n| –\n| –\n| –\n| 10%\n| –\n| style=\"background:#DFEEFF;\"| 25%\n| –\n| –\n| 3.5%\n| –\n| style=\"background:#C1CCE1;\"| 26%\n| –\n|-\n| 1%\n| 1%\n| 11%\n| –\n| 10%\n| 13%\n| –\n| –\n| –\n| 9.5%\n| –\n| –\n| style=\"background:#DFEEFF;\"| 23%\n| –\n| 4.5%\n| –\n| style=\"background:#C1CCE1;\"| 27%\n| –\n|-\n| 1%\n| 1.5%\n| 10%\n| –\n| 11%\n| 13.5%\n| –\n| –\n| –\n| 10%\n| –\n| –\n| –\n| style=\"background:#DFEEFF;\"| 21%\n| 4%\n| –\n| style=\"background:#C1CCE1;\"| 28%\n| –\n|-\n| rowspan=\"8\" style=\"background:#FFCCCC;\"| [https://www.ifop.com/wp-content/uploads/2018/03/3432-1-study_file.pdf Ifop-Fiducial]\n| rowspan=\"8\" data-sort-value=\"2016-06-17\"| 14–17 Jun 2016\n| rowspan=\"8\"| 1,858\n| rowspan=\"8\"| –\n| 0.5%\n| 1.5%\n| 12.5%\n| 2.5%\n| –\n| 14%\n| –\n| –\n| –\n| –\n| style=\"background:#B9DAFF;\"| 35%\n| –\n| –\n| –\n| 4.5%\n| –\n| style=\"background:#E0E5F0;\"| 29%\n| 0.5%\n|-\n| 1%\n| 1.5%\n| 13%\n| 2%\n| –\n| 15%\n| –\n| –\n| –\n| 12.5%\n| –\n| style=\"background:#DFEEFF;\"| 22%\n| –\n| –\n| 4.5%\n| –\n| style=\"background:#C1CCE1;\"| 28%\n| 0.5%\n|-\n| 0.5%\n| 1.5%\n| 14.5%\n| 2.5%\n| –\n| 15%\n| –\n| –\n| –\n| 12%\n| –\n| –\n| style=\"background:#DFEEFF;\"| 18%\n| –\n| 5.5%\n| –\n| style=\"background:#C1CCE1;\"| 30%\n| 0.5%\n|-\n| 0.5%\n| 1%\n| 14%\n| 2.5%\n| –\n| 16%\n| –\n| –\n| –\n| 12.5%\n| –\n| –\n| –\n| style=\"background:#DFEEFF;\"| 17%\n| 5.5%\n| –\n| style=\"background:#C1CCE1;\"| 30.5%\n| 0.5%\n|-\n| 0.5%\n| 1%\n| 11.5%\n| 2%\n| –\n| 14%\n| –\n| 4.5%\n| –\n| –\n| style=\"background:#B9DAFF;\"| 34%\n| –\n| –\n| –\n| 4.5%\n| –\n| style=\"background:#E0E5F0;\"| 28%\n| data-sort-value=\"0%\"|\n| 1.5%\n| 1.5%\n| 14%\n| 2%\n| –\n| 14%\n| –\n| –\n| –\n| –\n| style=\"background:#B9DAFF;\"| 36%\n| –\n| –\n| –\n| 5%\n| –\n| style=\"background:#E0E5F0;\"| 26%\n| –\n|-\n| 2%\n| 1%\n| 14%\n| 3%\n| –\n| 13%\n| –\n| –\n| –\n| 13%\n| –\n| style=\"background:#DFEEFF;\"| 21%\n| –\n| –\n| 5%\n| –\n| style=\"background:#C1CCE1;\"| 28%\n| –\n|-\n| 1.5%\n| 1.5%\n| 15%\n| 2%\n| –\n| 14%\n| –\n| –\n| –\n| 12%\n| –\n| –\n| style=\"background:#DFEEFF;\"| 19%\n| –\n| 6%\n| –\n| style=\"background:#C1CCE1;\"| 29%\n| –\n|-\n| 2%\n| 1%\n| 15%\n| 2%\n| –\n| 15%\n| –\n| –\n| –\n| 12%\n| –\n| –\n| –\n| style=\"background:#DFEEFF;\"| 19%\n| 5%\n| –\n| style=\"background:#C1CCE1;\"| 29%\n| –\n|-\n| rowspan=\"2\" style=\"background:#04FBF4;\"| [https://web.archive.org/web/20170308045511/https://www.soprasteria.com/docs/librariesprovider29/Publications-Ipsos/enqu%C3%AAte-%C3%A9lectorale-fran%C3%A7aise-2017-vague-4-mai-2016---ipsos-cevipof-le-monde.pdf Ipsos]\n| rowspan=\"2\" data-sort-value=\"2016-05-22\"| 13–22 May 2016\n| rowspan=\"2\"| 12,710\n| rowspan=\"2\"| –\n| 1.5%\n| 1.5%\n| 12%\n| 3%\n| –\n| 14%\n| –\n| –\n| –\n| –\n| style=\"background:#B9DAFF;\"| 35%\n| –\n| –\n| –\n| 5%\n| –\n| style=\"background:#E0E5F0;\"| 28%\n| data-sort-value=\"0%\"|\n| 0.5%\n| 1.5%\n| 12%\n| 4%\n| –\n| 13.5%\n| –\n| –\n| –\n| –\n| style=\"background:#B9DAFF;\"| 38%\n| –\n| –\n| –\n| 5.5%\n| –\n| style=\"background:#E0E5F0;\"| 25%\n| –\n|-\n| 0.5%\n| 1.5%\n| 12%\n| 3.5%\n| –\n| 15%\n| –\n| –\n| –\n| 13.5%\n| –\n| style=\"background:#DFEEFF;\"| 22%\n| –\n| –\n| 5%\n| –\n| style=\"background:#C1CCE1;\"| 27%\n| –\n|-\n| 0.5%\n| 1.5%\n| 13%\n| 3.5%\n| –\n| 15%\n| –\n| –\n| –\n| 14%\n| –\n| –\n| style=\"background:#DFEEFF;\"| 21%\n| –\n| 4.5%\n| –\n| style=\"background:#C1CCE1;\"| 27%\n| –\n|-\n| 0.5%\n| 2%\n| 13%\n| 3.5%\n| –\n| 16%\n| –\n| –\n| –\n| 16%\n| –\n| –\n| –\n| style=\"background:#DFEEFF;\"| 17%\n| 5%\n| –\n| style=\"background:#C1CCE1;\"| 27%\n| –\n|-\n| rowspan=\"2\" style=\"background:#FFCCCC;\"| [https://www.ifop.com/wp-content/uploads/2018/03/3383-1-study_file.pdf Ifop-Fiducial]\n| rowspan=\"2\" data-sort-value=\"2016-04-28\"| 25–28 Apr 2016\n| rowspan=\"2\"| 1,419\n| rowspan=\"2\"| –\n| 1.5%\n| 1%\n| 14%\n| 2.5%\n| –\n| –\n| –\n| –\n| 20%\n| –\n| style=\"background:#B9DAFF;\"| 29%\n| –\n| –\n| –\n| 6%\n| –\n| style=\"background:#E0E5F0;\"| 26%\n| data-sort-value=\"0%\"|\n| 1%\n| 2%\n| 13.5%\n| 3%\n| –\n| 13.5%\n| –\n| –\n| –\n| –\n| style=\"background:#B9DAFF;\"| 35%\n| –\n| –\n| –\n| 5%\n| –\n| style=\"background:#E0E5F0;\"| 27%\n| –\n|-\n| 1%\n| 2%\n| 12%\n| 3%\n| –\n| 14%\n| –\n| –\n| –\n| 12%\n| –\n| style=\"background:#DFEEFF;\"| 22%\n| –\n| –\n| 6%\n| –\n| style=\"background:#C1CCE1;\"| 28%\n| –\n|-\n| 1.5%\n| 2.5%\n| 13%\n| 3%\n| –\n| 14%\n| –\n| –\n| –\n| 11%\n| –\n| –\n| style=\"background:#DFEEFF;\"| 21%\n| –\n| 5%\n| –\n| style=\"background:#C1CCE1;\"| 29%\n| –\n|-\n| 2%\n| 2%\n| 13%\n| 3%\n| –\n| 15%\n| –\n| –\n| –\n| 11%\n| –\n| –\n| –\n| style=\"background:#DFEEFF;\"| 18%\n| 6%\n| –\n| style=\"background:#C1CCE1;\"| 30%\n| –\n|-\n| rowspan=\"5\" style=\"background:burlywood;\"| [https://www.tns-sofres.com/sites/default/files/2016.04.17-iv-presi2017.pdf TNS Sofres]\n| rowspan=\"5\" data-sort-value=\"2016-04-16\"| 15–16 Apr 2016\n| rowspan=\"5\"| 1,011\n| rowspan=\"5\"| 30%\n| 2%\n| 2%\n| 12%\n| 4%\n| –\n| 13%\n| –\n| –\n| –\n| –\n| style=\"background:#B9DAFF;\"| 35%\n| –\n| –\n| –\n| 6%\n| –\n| style=\"background:#E0E5F0;\"| 26%\n| –\n|-\n| 1.5%\n| 2.5%\n| 13%\n| 3%\n| –\n| 14%\n| –\n| –\n| –\n| 12%\n| –\n| style=\"background:#DFEEFF;\"| 23%\n| –\n| –\n| 6%\n| –\n| style=\"background:#C1CCE1;\"| 25%\n| –\n|-\n| 2%\n| 3%\n| 14%\n| 4%\n| –\n| 14%\n| –\n| –\n| –\n| –\n| –\n| –\n| style=\"background:#DFEEFF;\"| 23%\n| –\n| 8%\n| –\n| style=\"background:#C1CCE1;\"| 32%\n| –\n|-\n| 2%\n| 3%\n| 16%\n| 5%\n| –\n| 15%\n| –\n| –\n| –\n| –\n| –\n| –\n| –\n| style=\"background:#DFEEFF;\"| 21%\n| 8%\n| –\n| style=\"background:#C1CCE1;\"| 30%\n| –\n|-\n| 2%\n| 3%\n| 14%\n| 4%\n| –\n| 16%\n| –\n| –\n| –\n| –\n| –\n| style=\"background:#DFEEFF;\"| 24%\n| –\n| –\n| 8%\n| –\n| style=\"background:#C1CCE1;\"| 29%\n| –\n|-\n| rowspan=\"4\" style=\"background:#FFCCFF;\"| [http://www.odoxa.fr/wp-content/uploads/2016/04/odoxa-dentsuconsulting-bfm-leparisien-intentiondevotelaprsidentiellede201715avril2016-160415162721.pdf Odoxa]\n| rowspan=\"4\" data-sort-value=\"2016-04-15\"| 14–15 Apr 2016\n| rowspan=\"4\"| 949\n| rowspan=\"4\"| –\n| 1%\n| 2%\n| 11%\n| 1%\n| –\n| 14%\n| –\n| –\n| –\n| –\n| style=\"background:#B9DAFF;\"| 34%\n| –\n| –\n| –\n| 5%\n| –\n| style=\"background:#E0E5F0;\"| 32%\n| –\n|-\n| 1%\n| 2%\n| 11%\n| 2%\n| –\n| 15%\n| –\n| –\n| –\n| 13%\n| –\n| style=\"background:#DFEEFF;\"| 20%\n| –\n| –\n| 5%\n| –\n| style=\"background:#C1CCE1;\"| 31%\n| –\n|-\n| 1%\n| 2%\n| 12%\n| 2%\n| –\n| –\n| –\n| –\n| 18%\n| –\n| style=\"background:#DFEEFF;\"| 29%\n| –\n| –\n| –\n| 5%\n| –\n| style=\"background:#C1CCE1;\"| 31%\n| –\n|-\n| 1%\n| 2%\n| 11%\n| 2%\n| –\n| –\n| –\n| –\n| style=\"background:#FFE6EC;\"| 21%\n| 10%\n| –\n| 19%\n| –\n| –\n| 4%\n| –\n| style=\"background:#C1CCE1;\"| 30%\n| –\n|-\n| rowspan=\"10\" style=\"background:#FFCCCC;\"| [https://www.ifop.com/wp-content/uploads/2018/03/3363-1-study_file.pdf Ifop-Fiducial]\n| rowspan=\"10\" data-sort-value=\"2016-04-14\"| 12–14 Apr 2016\n| rowspan=\"10\"| 1,876\n| rowspan=\"10\"| –\n| 1%\n| 1%\n| 12%\n| 1.5%\n| –\n| 15%\n| –\n| –\n| –\n| –\n| style=\"background:#B9DAFF;\"| 37%\n| –\n| –\n| –\n| 5%\n| –\n| style=\"background:#E0E5F0;\"| 27%\n| 0.5%\n|-\n| 1%\n| 1%\n| 12.5%\n| 1.5%\n| –\n| 16%\n| –\n| –\n| –\n| 14%\n| –\n| style=\"background:#DFEEFF;\"| 21%\n| –\n| –\n| 5%\n| –\n| style=\"background:#C1CCE1;\"| 27.5%\n| 0.5%\n|-\n| 1%\n| 1.5%\n| 12.5%\n| 1.5%\n| –\n| 16%\n| –\n| –\n| –\n| 12%\n| –\n| –\n| style=\"background:#DFEEFF;\"| 21%\n| –\n| 6%\n| –\n| style=\"background:#C1CCE1;\"| 28%\n| 0.5%\n|-\n| 1%\n| 1%\n| 13.5%\n| 1.5%\n| –\n| 16%\n| –\n| –\n| –\n| 13%\n| –\n| –\n| –\n| style=\"background:#DFEEFF;\"| 20%\n| 5.5%\n| –\n| style=\"background:#C1CCE1;\"| 28%\n| 0.5%\n|-\n| 1%\n| 1%\n| 11%\n| 1%\n| –\n| 14%\n| –\n| –\n| –\n| 7%\n| style=\"background:#B9DAFF;\"| 34%\n| –\n| –\n| –\n| 4%\n| –\n| style=\"background:#E0E5F0;\"| 26.5%\n| 0.5%\n|-\n| 1%\n| 1%\n| 12.5%\n| 1.5%\n| –\n| –\n| 16%\n| –\n| –\n| –\n| style=\"background:#B9DAFF;\"| 36%\n| –\n| –\n| –\n| 4.5%\n| –\n| style=\"background:#E0E5F0;\"| 27%\n| 0.5%\n|-\n| 1%\n| 1%\n| 13.5%\n| 1.5%\n| –\n| –\n| 17%\n| –\n| –\n| 12.5%\n| –\n| style=\"background:#DFEEFF;\"| 21%\n| –\n| –\n| 5%\n| –\n| style=\"background:#C1CCE1;\"| 27%\n| 0.5%\n|-\n| 0.5%\n| 1.5%\n| 10.5%\n| –\n| 7%\n| 14%\n| –\n| –\n| –\n| –\n| style=\"background:#B9DAFF;\"| 36%\n| –\n| –\n| –\n| 4%\n| –\n| style=\"background:#E0E5F0;\"| 26%\n| 0.5%\n|-\n| 1%\n| 1%\n| 11%\n| 1%\n| –\n| 14%\n| –\n| 3.5%\n| –\n| –\n| style=\"background:#B9DAFF;\"| 36%\n| –\n| –\n| –\n| 5%\n| –\n| style=\"background:#E0E5F0;\"| 27%\n| 0.5%\n|-\n| 1%\n| 2%\n| 12%\n| 1%\n| –\n| –\n| –\n| 4%\n| 16%\n| –\n| style=\"background:#B9DAFF;\"| 33%\n| –\n| –\n| –\n| 4.5%\n| –\n| style=\"background:#E0E5F0;\"| 26%\n| 0.5%\n|-\n| rowspan=\"2\" style=\"background:GreenYellow;\"| [https://web.archive.org/web/20160427002648/http://harris-interactive.fr/wp-content/uploads/sites/6/2016/04/Rapport-Harris-Le-regard-des-Fran%C3%A7ais-sur-lavenir-politique-de-Nicolas-Hulot-We-Demain.pdf Harris Interactive]\n| rowspan=\"2\" data-sort-value=\"2016-04-13\"| 11–13 Apr 2016\n| rowspan=\"2\"| 1,535\n| rowspan=\"2\"| –\n| 2%\n| 1%\n| 11%\n| 2%\n| 11%\n| 13%\n| –\n| –\n| –\n| –\n| style=\"background:#DFEEFF;\"| 26%\n| –\n| –\n| –\n| 5%\n| –\n| style=\"background:#C1CCE1;\"| 29%\n| –\n|-\n| 1%\n| 1%\n| 10%\n| 1%\n| 9%\n| 14%\n| –\n| –\n| –\n| 12%\n| –\n| style=\"background:#DFEEFF;\"| 19%\n| –\n| –\n| 6%\n| –\n| style=\"background:#C1CCE1;\"| 27%\n| –\n|-\n| rowspan=\"3\" style=\"background:#04FBF4;\"| [https://www.ipsos.com/sites/default/files/files-fr-fr/doc_associe/ipsos_cevipof_le_monde_-_rapport_complet.pdf Ipsos]\n| rowspan=\"3\" data-sort-value=\"2016-03-20\"| 11–20 Mar 2016\n| rowspan=\"3\"| 13,693\n| rowspan=\"3\"| –\n| 1.5%\n| 1.5%\n| 11%\n| 3%\n| –\n| 15%\n| –\n| –\n| –\n| –\n| style=\"background:#B9DAFF;\"| 36%\n| –\n| –\n| –\n| 5%\n| –\n| style=\"background:#E0E5F0;\"| 27%\n| –\n|-\n| 1.5%\n| 1.5%\n| 11%\n| 3%\n| –\n| 16%\n| –\n| –\n| –\n| 13%\n| –\n| style=\"background:#DFEEFF;\"| 21%\n| –\n| –\n| 6%\n| –\n| style=\"background:#C1CCE1;\"| 27%\n| –\n|-\n| 1.5%\n| 1.5%\n| 10%\n| 3%\n| –\n| 14%\n| –\n| –\n| –\n| 8%\n| style=\"background:#B9DAFF;\"| 31%\n| –\n| –\n| –\n| 5%\n| –\n| style=\"background:#E0E5F0;\"| 26%\n| –\n|-\n| rowspan=\"2\" style=\"background:#FFCCCC;\"| [https://www.ifop.com/wp-content/uploads/2018/03/3327-1-study_file.pdf Ifop-Fiducial]\n| rowspan=\"2\" data-sort-value=\"2016-03-14\"| 11–14 Mar 2016\n| rowspan=\"2\"| 1,026\n| rowspan=\"2\"| –\n| 1.5%\n| 2.5%\n| 15%\n| 2.5%\n| –\n| –\n| –\n| –\n| 14%\n| –\n| style=\"background:#B9DAFF;\"| 32%\n| –\n| –\n| –\n| 3%\n| –\n| style=\"background:#E0E5F0;\"| 29.5%\n| –\n|-\n| 1%\n| 2%\n| 15%\n| 2.5%\n| –\n| –\n| –\n| –\n| 17%\n| 11%\n| –\n| style=\"background:#DFEEFF;\"| 19%\n| –\n| –\n| 4.5%\n| –\n| style=\"background:#C1CCE1;\"| 28%\n| –\n|-\n| rowspan=\"7\" style=\"background:#FFCCCC;\"| [https://www.ifop.com/wp-content/uploads/2018/03/3309-1-study_file.pdf Ifop-Fiducial]\n| rowspan=\"7\" data-sort-value=\"2016-02-19\"| 17–19 Feb 2016\n| rowspan=\"7\"| 1,843\n| rowspan=\"7\"| –\n| 1%\n| 1%\n| 11%\n| 2%\n| –\n| 18%\n| –\n| –\n| –\n| –\n| style=\"background:#B9DAFF;\"| 35%\n| –\n| –\n| –\n| 4%\n| –\n| style=\"background:#E0E5F0;\"| 28%\n| –\n|-\n| 1%\n| 1.5%\n| 11.5%\n| 2%\n| –\n| 18%\n| –\n| –\n| –\n| 15%\n| –\n| style=\"background:#DFEEFF;\"| 21%\n| –\n| –\n| 5%\n| –\n| style=\"background:#C1CCE1;\"| 25%\n| –\n|-\n| 1%\n| 1%\n| 12%\n| 2.5%\n| –\n| style=\"background:#FFE6EC;\"| 18%\n| –\n| –\n| –\n| 14.5%\n| –\n| –\n| style=\"background:#DFEEFF;\"| 18%\n| –\n| 5%\n| –\n| style=\"background:#C1CCE1;\"| 28%\n| –\n|-\n| 1%\n| 1%\n| 12%\n| 3%\n| –\n| style=\"background:#FFE6EC;\"| 18%\n| –\n| –\n| –\n| 15%\n| –\n| –\n| –\n| 17%\n| 5%\n| –\n| style=\"background:#C1CCE1;\"| 28%\n| –\n|-\n| 1%\n| 1%\n| 10%\n| 2.5%\n| –\n| 16%\n| –\n| –\n| –\n| 8.5%\n| style=\"background:#B9DAFF;\"| 30%\n| –\n| –\n| –\n| 4%\n| –\n| style=\"background:#E0E5F0;\"| 27%\n| –\n|-\n| 1%\n| 1.5%\n| 12%\n| –\n| –\n| 18%\n| –\n| –\n| –\n| 15.5%\n| –\n| style=\"background:#DFEEFF;\"| 21%\n| –\n| –\n| 5%\n| –\n| style=\"background:#C1CCE1;\"| 26%\n| –\n|-\n| 2%\n| 3.5%\n| –\n| –\n| –\n| style=\"background:#FFE6EC;\"| 22%\n| –\n| –\n| –\n| 18%\n| –\n| 21.5%\n| –\n| –\n| 5%\n| –\n| style=\"background:#C1CCE1;\"| 28%\n| –\n|-\n| rowspan=\"3\" style=\"background:#04FBF4;\"| [https://www.ipsos.com/sites/default/files/files-fr-fr/doc_associe/enquete_electorale_francaise_2017_-_fevrier_2016.pdf Ipsos]\n| rowspan=\"3\" data-sort-value=\"2016-01-31\"| 22–31 Jan 2016\n| rowspan=\"3\"| 14,954\n| rowspan=\"3\"| –\n| 1.5%\n| 1.5%\n| 8.5%\n| 2.5%\n| –\n| 18%\n| –\n| –\n| –\n| 8%\n| style=\"background:#B9DAFF;\"| 31%\n| –\n| –\n| –\n| 4%\n| –\n| style=\"background:#E0E5F0;\"| 25%\n| –\n|-\n| 1.5%\n| 1.5%\n| 9%\n| 3%\n| –\n| 20%\n| –\n| –\n| –\n| 13%\n| –\n| style=\"background:#DFEEFF;\"| 21%\n| –\n| –\n| 5%\n| –\n| style=\"background:#C1CCE1;\"| 26%\n| –\n|-\n| 1.5%\n| 1.5%\n| 9%\n| 3%\n| –\n| style=\"background:#FFE6EC;\"| 20%\n| –\n| –\n| –\n| 12%\n| –\n| –\n| 19%\n| –\n| 5%\n| –\n| style=\"background:#C1CCE1;\"| 29%\n| –\n|-\n| rowspan=\"4\" style=\"background:#FFCCFF;\"| [http://www.odoxa.fr/wp-content/uploads/2016/01/odoxapourleparisien-aujourdhuienfrance-lesfranaisetlaprsiden-160116210046.pdf Odoxa]\n| rowspan=\"4\" data-sort-value=\"2016-01-15\"| 14–15 Jan 2016\n| rowspan=\"4\"| 1,011\n| rowspan=\"4\"| –\n| 1%\n| 2%\n| 9%\n| 3%\n| –\n| 16%\n| –\n| –\n| –\n| –\n| style=\"background:#B9DAFF;\"| 34%\n| –\n| –\n| –\n| 5%\n| –\n| style=\"background:#E0E5F0;\"| 30%\n| –\n|-\n| 1%\n| 1%\n| 11%\n| 2%\n| –\n| 19%\n| –\n| –\n| –\n| 13%\n| –\n| style=\"background:#DFEEFF;\"| 20%\n| –\n| –\n| 5%\n| –\n| style=\"background:#C1CCE1;\"| 28%\n| –\n|-\n| 2%\n| 2%\n| 11%\n| 2%\n| –\n| –\n| –\n| –\n| 19%\n| –\n| style=\"background:#B9DAFF;\"| 32%\n| –\n| –\n| –\n| 4%\n| –\n| style=\"background:#E0E5F0;\"| 28%\n| –\n|-\n| 2%\n| 1%\n| 12%\n| 2%\n| –\n| –\n| –\n| –\n| style=\"background:#FFE6EC;\"| 22%\n| 12%\n| –\n| 18%\n| –\n| –\n| 4%\n| –\n| style=\"background:#C1CCE1;\"| 27%\n| –\n|}\n;With additional sponsorship-collecting candidates\n{| class=\"wikitable sortable\" style=\"text-align:center;font-size:90%;line-height:14px;\"\n|- style=\"height:40px;\"\n! style=\"width:100px;\" rowspan=\"2\"| Polling firm\n! style=\"width:110px;\" rowspan=\"2\"| Fieldwork date\n! style=\"width:35px;\" rowspan=\"2\"| Samplesize\n! class=\"unsortable\" style=\"width:60px;\"| Arthaud\n! class=\"unsortable\" style=\"width:60px;\"| Poutou\n! class=\"unsortable\" style=\"width:60px;\"| Mélenchon\n! class=\"unsortable\" style=\"width:60px;\"| Duflot\n! class=\"unsortable\" style=\"width:60px;\"| Hollande\n! class=\"unsortable\" style=\"width:60px;\"| Montebourg\n! class=\"unsortable\" style=\"width:60px;\"| Bayrou\n! class=\"unsortable\" style=\"width:60px;\"| Lassalle\n! class=\"unsortable\" style=\"width:60px;\"| Yade\n! class=\"unsortable\" style=\"width:60px;\"| Sarkozy\n! class=\"unsortable\" style=\"width:60px;\"| Guaino\n! class=\"unsortable\" style=\"width:60px;\"| Dupont-Aignan\n! class=\"unsortable\" style=\"width:60px;\"| Asselineau\n! class=\"unsortable\" style=\"width:60px;\"| Le Pen\n! class=\"unsortable\" style=\"width:60px;\"| Cheminade\n|-\n! style=\"background:;\"|\n! style=\"background:;\"|\n! style=\"background:;\"|\n! style=\"background:;\"|\n! style=\"background:;\"|\n! style=\"background:;\"|\n! style=\"background:;\"|\n! style=\"background:;\"|\n! style=\"background:;\"|\n! style=\"background:;\"|\n! style=\"background:;\"|\n! style=\"background:;\"|\n! style=\"background:;\"|\n! style=\"background:;\"|\n! style=\"background:;\"|\n|-\n| style=\"background:#FFCCCC;\"| [https://www.ifop.com/wp-content/uploads/2018/03/3432-1-study_file.pdf Ifop-Fiducial]\n| data-sort-value=\"2016-06-17\"| 14–17 Jun 2016\n| 1,858\n| 0.5%\n| 1%\n| 12%\n| 1%\n| 14.5%\n| 4.5%\n| 11%\n| 0.5%\n| 1%\n| style=\"background:#DFEEFF;\"| 21%\n| 1%\n| 4%\n| 0.5%\n| style=\"background:#C1CCE1;\"| 27.5%\n| data-sort-value=\"0%\"| size\n! style=\"width:30px;\" rowspan=\"2\"|\n! class=\"unsortable\" style=\"width:60px;\"| Arthaud\n! class=\"unsortable\" style=\"width:60px;\"| Poutou\n! class=\"unsortable\" style=\"width:60px;\"| Besancenot\n! class=\"unsortable\" style=\"width:60px;\"| Mélenchon\n! class=\"unsortable\" style=\"width:60px;\"| Joly\n! class=\"unsortable\" style=\"width:60px;\"| Duflot\n! class=\"unsortable\" style=\"width:60px;\"| Hollande\n! class=\"unsortable\" style=\"width:60px;\"| Valls\n! class=\"unsortable\" style=\"width:60px;\"| Montebourg\n! class=\"unsortable\" style=\"width:60px;\"| Aubry\n! class=\"unsortable\" style=\"width:60px;\"| Bayrou\n! class=\"unsortable\" style=\"width:60px;\"| Juppé\n! class=\"unsortable\" style=\"width:60px;\"| Sarkozy\n! class=\"unsortable\" style=\"width:60px;\"| Fillon\n! class=\"unsortable\" style=\"width:60px;\"| Copé\n! class=\"unsortable\" style=\"width:60px;\"| Dupont-Aignan\n! class=\"unsortable\" style=\"width:60px;\"| Villiers\n! class=\"unsortable\" style=\"width:60px;\"| Le Pen\n! class=\"unsortable\" style=\"width:60px;\"| Cheminade\n|-\n! style=\"background:;\"|\n! style=\"background:;\"|\n! style=\"background:;\"|\n! style=\"background:;\"|\n! style=\"background:;\"|\n! style=\"background:;\"|\n! style=\"background:;\"|\n! style=\"background:;\"|\n! style=\"background:;\"|\n! style=\"background:;\"|\n! style=\"background:;\"|\n! style=\"background:;\"|\n! style=\"background:;\"|\n! style=\"background:;\"|\n! style=\"background:;\"|\n! style=\"background:;\"|\n! style=\"background:;\"|\n! style=\"background:;\"|\n! style=\"background:;\"|\n|-\n| rowspan=\"5\" style=\"background:#FFCCCC;\"| [https://www.ifop.com/wp-content/uploads/2018/03/3244-1-study_file.pdf Ifop]\n| rowspan=\"5\" data-sort-value=\"2015-12-17\"| 14–17 Dec 2015\n| rowspan=\"5\"| 1,800\n| rowspan=\"5\"| –\n| 1%\n| 1%\n| –\n| 9.5%\n| –\n| 2.5%\n| 20.5%\n| –\n| –\n| –\n| –\n| style=\"background:#B9DAFF;\"| 34%\n| –\n| –\n| –\n| 5%\n| –\n| style=\"background:#E0E5F0;\"| 26.5%\n| –\n|-\n| 1%\n| 1%\n| –\n| 9%\n| –\n| 2%\n| style=\"background:#FFE6EC;\"| 22%\n| –\n| –\n| –\n| 12%\n| –\n| 21%\n| –\n| –\n| 5%\n| –\n| style=\"background:#C1CCE1;\"| 27%\n| –\n|-\n| 1%\n| 1%\n| –\n| 9%\n| –\n| 2%\n| style=\"background:#FFE6EC;\"| 23%\n| –\n| –\n| –\n| 10%\n| –\n| –\n| 19.5%\n| –\n| 5.5%\n| –\n| style=\"background:#C1CCE1;\"| 29%\n| –\n|-\n| 1%\n| 1%\n| –\n| 8.5%\n| –\n| 2%\n| 20.5%\n| –\n| –\n| –\n| 6.5%\n| style=\"background:#B9DAFF;\"| 30%\n| –\n| –\n| –\n| 4.5%\n| –\n| style=\"background:#E0E5F0;\"| 26%\n| –\n|-\n| 1%\n| 1%\n| –\n| 9%\n| –\n| 2%\n| style=\"background:#FFE6EC;\"| 22.5%\n| –\n| –\n| –\n| 12%\n| –\n| 22%\n| –\n| –\n| –\n| 3%\n| style=\"background:#C1CCE1;\"| 27.5%\n| –\n|-\n| rowspan=\"3\" style=\"background:burlywood;\"| [https://www.tns-sofres.com/sites/default/files/2015.12.15-presi2017-iv.pdf TNS Sofres]\n| rowspan=\"3\" data-sort-value=\"2015-12-15\"| 14–15 Dec 2015\n| rowspan=\"3\"| 1,000\n| rowspan=\"3\"| –\n| 1%\n| 1.5%\n| –\n| 11%\n| –\n| 3%\n| 20%\n| –\n| –\n| –\n| –\n| style=\"background:#B9DAFF;\"| 31%\n| –\n| –\n| –\n| 4.5%\n| –\n| style=\"background:#E0E5F0;\"| 28%\n| –\n|-\n| 1%\n| 1.5%\n| –\n| 10.5%\n| –\n| 3%\n| 19%\n| –\n| –\n| –\n| 10.5%\n| –\n| style=\"background:#DFEEFF;\"| 24%\n| –\n| –\n| 4.5%\n| –\n| style=\"background:#C1CCE1;\"| 26%\n| –\n|-\n| 1%\n| 1.5%\n| –\n| 12%\n| –\n| 3%\n| 22%\n| –\n| –\n| –\n| –\n| –\n| style=\"background:#DFEEFF;\"| 26%\n| –\n| –\n| 7%\n| –\n| style=\"background:#C1CCE1;\"| 27.5%\n| –\n|-\n| rowspan=\"2\" style=\"background:GreenYellow;\"| [https://web.archive.org/web/20160227002350/http://harris-interactive.fr/wp-content/uploads/sites/6/2015/12/Rapport-Harris-R%C3%A9gionales-2015-Etude-Soir-du-vote-du-2nd-tour-M6.pdf Harris Interactive]\n| rowspan=\"2\" data-sort-value=\"2015-12-13\"| 13 Dec 2015\n| rowspan=\"2\"| 1,020\n| rowspan=\"2\"| –\n| 1%\n| 1%\n| –\n| 10%\n| –\n| 3%\n| 22%\n| –\n| –\n| –\n| –\n| style=\"background:#B9DAFF;\"| 29%\n| –\n| –\n| –\n| 7%\n| –\n| style=\"background:#E0E5F0;\"| 27%\n| –\n|-\n| 1%\n| 1%\n| –\n| 10%\n| –\n| 3%\n| 21%\n| –\n| –\n| –\n| 12%\n| –\n| style=\"background:#DFEEFF;\"| 21%\n| –\n| –\n| 4%\n| –\n| style=\"background:#C1CCE1;\"| 27%\n| –\n|-\n| rowspan=\"3\" style=\"background:#FFCCCC;\"| [https://www.ifop.com/wp-content/uploads/2018/03/3198-1-study_file.pdf Ifop-Fiducial]\n| rowspan=\"3\" data-sort-value=\"2015-11-04\"| 31 Oct–4 Nov 2015\n| rowspan=\"3\"| 937\n| rowspan=\"3\"| –\n| 1%\n| 2%\n| –\n| 9%\n| –\n| 3%\n| 20.5%\n| –\n| –\n| –\n| –\n| style=\"background:#B9DAFF;\"| 31.5%\n| –\n| –\n| –\n| 4%\n| –\n| style=\"background:#E0E5F0;\"| 29%\n| –\n|-\n| 1%\n| 1.5%\n| –\n| 8%\n| –\n| 2%\n| 21%\n| –\n| –\n| –\n| 12%\n| –\n| style=\"background:#DFEEFF;\"| 23%\n| –\n| –\n| 3.5%\n| –\n| style=\"background:#C1CCE1;\"| 28%\n| –\n|-\n| 1%\n| 2%\n| –\n| 8%\n| –\n| 2%\n| 19%\n| –\n| –\n| –\n| 9%\n| style=\"background:#DFEEFF;\"| 27%\n| –\n| –\n| –\n| 3%\n| –\n| style=\"background:#C1CCE1;\"| 29%\n| –\n|-\n| rowspan=\"2\" style=\"background:#FFCCCC;\"| [https://www.ifop.com/wp-content/uploads/2018/03/3119-1-study_file.pdf Ifop]\n| rowspan=\"2\" data-sort-value=\"2015-09-04\"| 3–4 Sep 2015\n| rowspan=\"2\"| 1,002\n| rowspan=\"2\"| –\n| 1%\n| 1%\n| –\n| 10%\n| –\n| 2%\n| 19%\n| –\n| –\n| –\n| 10%\n| style=\"background:#DFEEFF;\"| 25%\n| –\n| –\n| –\n| 3%\n| –\n| style=\"background:#C1CCE1;\"| 29%\n| –\n|-\n| 1%\n| 1.5%\n| –\n| 10%\n| –\n| 2%\n| 19%\n| –\n| –\n| –\n| 11.5%\n| –\n| style=\"background:#DFEEFF;\"| 25%\n| –\n| –\n| 3%\n| –\n| style=\"background:#C1CCE1;\"| 27%\n| –\n|-\n| rowspan=\"3\" style=\"background:#FFCCCC;\"| [https://www.ifop.com/wp-content/uploads/2018/03/3109-1-study_file.pdf Ifop]\n| rowspan=\"3\" data-sort-value=\"2015-08-19\"| 17–19 Aug 2015\n| rowspan=\"3\"| 950\n| rowspan=\"3\"| –\n| 1.5%\n| 1.5%\n| –\n| 9%\n| –\n| 3%\n| 20%\n| –\n| –\n| –\n| 11%\n| –\n| style=\"background:#DFEEFF;\"| 24%\n| –\n| –\n| 4%\n| –\n| style=\"background:#C1CCE1;\"| 26%\n| –\n|-\n| 1.5%\n| 1.5%\n| –\n| 10%\n| –\n| 2%\n| –\n| 22%\n| –\n| –\n| 11%\n| –\n| style=\"background:#DFEEFF;\"| 23%\n| –\n| –\n| 3%\n| –\n| style=\"background:#C1CCE1;\"| 26%\n| –\n|-\n| 1%\n| 1%\n| –\n| 13%\n| –\n| 4%\n| –\n| –\n| 8%\n| –\n| 17%\n| –\n| style=\"background:#DFEEFF;\"| 25%\n| –\n| –\n| 4%\n| –\n| style=\"background:#C1CCE1;\"| 27%\n| –\n|-\n| rowspan=\"2\" style=\"background:#FFCCCC;\"| [https://www.ifop.com/wp-content/uploads/2018/03/3099-1-study_file.pdf Ifop]\n| rowspan=\"2\" data-sort-value=\"2015-07-21\"| 17–21 Jul 2015\n| rowspan=\"2\"| 944\n| rowspan=\"2\"| –\n| 1%\n| 1%\n| –\n| 9%\n| –\n| 3%\n| 18%\n| –\n| –\n| –\n| 9%\n| style=\"background:#B9DAFF;\"| 28%\n| –\n| –\n| –\n| 4%\n| –\n| style=\"background:#E0E5F0;\"| 27%\n| –\n|-\n| 1%\n| 1%\n| –\n| 9%\n| –\n| 3%\n| 21%\n| –\n| –\n| –\n| 12%\n| –\n| style=\"background:#DFEEFF;\"| 23%\n| –\n| –\n| 3%\n| –\n| style=\"background:#C1CCE1;\"| 27%\n| –\n|-\n| rowspan=\"2\" style=\"background:#FFCCFF;\"| [http://www.odoxa.fr/wp-content/uploads/2015/05/odoxa-pour-le-parisien-aujourdhui-en-france-2017-lhypothse-jupp-160201135908.pdf Odoxa]\n| rowspan=\"2\" data-sort-value=\"2015-05-22\"| 21–22 May 2015\n| rowspan=\"2\"| 911\n| rowspan=\"2\"| –\n| 1%\n| 2%\n| –\n| 11%\n| –\n| 2%\n| 16%\n| –\n| –\n| –\n| –\n| style=\"background:#B9DAFF;\"| 34%\n| –\n| –\n| –\n| 3%\n| –\n| style=\"background:#E0E5F0;\"| 31%\n| –\n|-\n| 1%\n| 1%\n| –\n| 10%\n| –\n| 2%\n| 17%\n| –\n| –\n| –\n| 12%\n| –\n| style=\"background:#DFEEFF;\"| 25%\n| –\n| –\n| 2%\n| –\n| style=\"background:#C1CCE1;\"| 30%\n| –\n|-\n| rowspan=\"2\" style=\"background:#FFCCFF;\"| [http://www.odoxa.fr/wp-content/uploads/2015/05/odoxa-pour-le-parisien-aujourdhui-en-france-quels-scnarios-pour-2017-160201112820.pdf Odoxa]\n| rowspan=\"2\" data-sort-value=\"2015-04-30\"| 29–30 Apr 2015\n| rowspan=\"2\"| 1,021\n| rowspan=\"2\"| –\n| 1%\n| 1%\n| –\n| 10%\n| –\n| 2%\n| 17%\n| –\n| –\n| –\n| 9%\n| –\n| style=\"background:#DFEEFF;\"| 28%\n| –\n| –\n| 3%\n| –\n| style=\"background:#C1CCE1;\"| 29%\n| –\n|-\n| 1%\n| 1%\n| –\n| 8%\n| –\n| 2%\n| –\n| 20%\n| –\n| –\n| 10%\n| –\n| style=\"background:#DFEEFF;\"| 26%\n| –\n| –\n| 3%\n| –\n| style=\"background:#C1CCE1;\"| 29%\n| –\n|-\n| rowspan=\"2\" style=\"background:aquamarine;\"| [https://www.opinion-way.com/fr/sondage-d-opinion/sondages-publies.html?task=document.viewdoc&id=1152 OpinionWay]\n| rowspan=\"2\" data-sort-value=\"2015-04-16\"| 15–16 Apr 2015\n| rowspan=\"2\"| 979\n| rowspan=\"2\"| –\n| 1%\n| 0%\n| –\n| 11%\n| –\n| 2%\n| 15%\n| –\n| –\n| –\n| 6%\n| style=\"background:#B9DAFF;\"| 32%\n| –\n| –\n| –\n| 4%\n| –\n| style=\"background:#E0E5F0;\"| 29%\n| 0%\n|-\n| 1%\n| 0%\n| –\n| 12%\n| –\n| 2%\n| 16%\n| –\n| –\n| –\n| 12%\n| –\n| style=\"background:#B9DAFF;\"| 28%\n| –\n| –\n| 3%\n| –\n| style=\"background:#E0E5F0;\"| 26%\n| 0%\n|-\n| rowspan=\"4\" style=\"background:yellow;\"| [http://media.rtl.fr/internal/binary/2015/0129/7776381771_les-intentions-de-vote-pour-la-presidentielle-2017.pdf CSA]\n| rowspan=\"4\" data-sort-value=\"2015-01-29\"| 27–29 Jan 2015\n| rowspan=\"4\"| 951\n| rowspan=\"4\"| –\n| 0.5%\n| –\n| 3%\n| 11%\n| –\n| 2%\n| 18%\n| –\n| –\n| –\n| 9%\n| style=\"background:#DFEEFF;\"| 22%\n| –\n| –\n| –\n| 2.5%\n| –\n| style=\"background:#C1CCE1;\"| 32%\n| –\n|-\n| 0.5%\n| –\n| 3%\n| 10%\n| –\n| 2.5%\n| 19%\n| –\n| –\n| –\n| 11%\n| –\n| style=\"background:#DFEEFF;\"| 22.5%\n| –\n| –\n| 2.5%\n| –\n| style=\"background:#C1CCE1;\"| 29%\n| –\n|-\n| 0.5%\n| –\n| 2.5%\n| 10%\n| –\n| 3%\n| –\n| style=\"background:#FFE6EC;\"| 21%\n| –\n| –\n| 8%\n| 19%\n| –\n| –\n| –\n| 3%\n| –\n| style=\"background:#C1CCE1;\"| 33%\n| –\n|-\n| 0.5%\n| –\n| 3%\n| 9%\n| –\n| 2%\n| –\n| style=\"background:#FFE6EC;\"| 22.5%\n| –\n| –\n| 10%\n| –\n| 21.5%\n| –\n| –\n| 2.5%\n| –\n| style=\"background:#C1CCE1;\"| 29%\n| –\n|-\n| rowspan=\"4\" style=\"background:#FFCCCC;\"| [https://www.ifop.com/wp-content/uploads/2018/03/2918-1-study_file.pdf Ifop]\n| rowspan=\"4\" data-sort-value=\"2015-01-23\"| 21–23 Jan 2015\n| rowspan=\"4\"| 983\n| rowspan=\"4\"| –\n| 1%\n| 2%\n| –\n| 8%\n| –\n| 4%\n| 21%\n| –\n| –\n| –\n| 7%\n| style=\"background:#DFEEFF;\"| 23%\n| –\n| –\n| –\n| 3%\n| –\n| style=\"background:#C1CCE1;\"| 31%\n| –\n|-\n| 1%\n| 2%\n| –\n| 8%\n| –\n| 3%\n| 21%\n| –\n| –\n| –\n| 9%\n| –\n| style=\"background:#DFEEFF;\"| 23%\n| –\n| –\n| 4%\n| –\n| style=\"background:#C1CCE1;\"| 29%\n| –\n|-\n| 1.5%\n| 1.5%\n| –\n| 8%\n| –\n| 3%\n| –\n| style=\"background:#FFE6EC;\"| 23%\n| –\n| –\n| 7%\n| 22%\n| –\n| –\n| –\n| 3%\n| –\n| style=\"background:#C1CCE1;\"| 31%\n| –\n|-\n| 1%\n| 1%\n| –\n| 8%\n| –\n| 4%\n| –\n| style=\"background:#FFE6EC;\"| 23%\n| –\n| –\n| 7%\n| –\n| style=\"background:#DFEEFF;\"| 23%\n| –\n| –\n| 3%\n| –\n| style=\"background:#C1CCE1;\"| 30%\n| –\n|-\n| rowspan=\"8\" style=\"background:#FFCCCC;\"| [https://www.ifop.com/wp-content/uploads/2018/03/2826-1-study_file.pdf Ifop-Fiducial]\n| rowspan=\"8\" data-sort-value=\"2014-10-30\"| 28–30 Oct 2014\n| rowspan=\"8\"| 1,382\n| rowspan=\"8\"| –\n| 1.5%\n| 1.5%\n| –\n| 10%\n| –\n| 4%\n| 15%\n| –\n| –\n| –\n| –\n| style=\"background:#B9DAFF;\"| 32%\n| –\n| –\n| –\n| 4%\n| –\n| style=\"background:#C1CCE1;\"| 32%\n| –\n|-\n| 1.5%\n| 1.5%\n| –\n| 9%\n| –\n| 3%\n| 14%\n| –\n| –\n| –\n| 13%\n| –\n| style=\"background:#DFEEFF;\"| 26%\n| –\n| –\n| 3%\n| –\n| style=\"background:#C1CCE1;\"| 29%\n| –\n|-\n| 1.5%\n| 1.5%\n| –\n| 9%\n| –\n| 4%\n| 14%\n| –\n| –\n| –\n| 16%\n| –\n| –\n| style=\"background:#DFEEFF;\"| 18%\n| –\n| 5%\n| –\n| style=\"background:#C1CCE1;\"| 31%\n| –\n|-\n| 1.5%\n| 1.5%\n| –\n| 9%\n| –\n| 3%\n| 13%\n| –\n| –\n| –\n| 10%\n| style=\"background:#DFEEFF;\"| 28%\n| –\n| –\n| –\n| 4%\n| –\n| style=\"background:#C1CCE1;\"| 30%\n| –\n|-\n| 1.5%\n| 1.5%\n| –\n| 9%\n| –\n| –\n| 15%\n| –\n| –\n| –\n| 14%\n| –\n| style=\"background:#DFEEFF;\"| 26%\n| –\n| –\n| 4%\n| –\n| style=\"background:#C1CCE1;\"| 29%\n| –\n|-\n| 2%\n| 1.5%\n| –\n| 8.5%\n| –\n| 3%\n| –\n| 15%\n| –\n| –\n| 13%\n| –\n| style=\"background:#B9DAFF;\"| 27%\n| –\n| –\n| 3%\n| –\n| style=\"background:#C1CCE1;\"| 27%\n| –\n|-\n| 1.5%\n| 1.5%\n| –\n| 9%\n| –\n| 2%\n| –\n| –\n| –\n| 13%\n| 10%\n| style=\"background:#B9DAFF;\"| 30%\n| –\n| –\n| –\n| 4%\n| –\n| style=\"background:#E0E5F0;\"| 29%\n| –\n|-\n| 2%\n| 1.5%\n| –\n| 8%\n| –\n| 3%\n| –\n| –\n| –\n| 14%\n| 14%\n| –\n| style=\"background:#B9DAFF;\"| 27%\n| –\n| –\n| 3.5%\n| –\n| style=\"background:#C1CCE1;\"| 27%\n| –\n|-\n| rowspan=\"3\" style=\"background:#FFCCCC;\"| [https://www.ifop.com/wp-content/uploads/2018/03/2755-1-study_file.pdf Ifop]\n| rowspan=\"3\" data-sort-value=\"2014-09-04\"| 3–4 Sep 2014\n| rowspan=\"3\"| 994\n| rowspan=\"3\"| –\n| 1%\n| 1%\n| –\n| 10%\n| –\n| 3%\n| 16%\n| –\n| –\n| –\n| 11%\n| style=\"background:#DFEEFF;\"| 24%\n| –\n| –\n| –\n| 4%\n| –\n| style=\"background:#C1CCE1;\"| 30%\n| –\n|-\n| 1%\n| 1%\n| –\n| 10%\n| –\n| 3%\n| 16%\n| –\n| –\n| –\n| 12%\n| –\n| style=\"background:#DFEEFF;\"| 25%\n| –\n| –\n| 4%\n| –\n| style=\"background:#C1CCE1;\"| 28%\n| –\n|-\n| 1%\n| 1%\n| –\n| 10%\n| –\n| 3%\n| style=\"background:#FFE6EC;\"| 17%\n| –\n| –\n| –\n| 14%\n| –\n| –\n| style=\"background:#DFEEFF;\"| 17%\n| –\n| 5%\n| –\n| style=\"background:#C1CCE1;\"| 32%\n| –\n|-\n| rowspan=\"3\" style=\"background:#FFCCCC;\"| [https://www.ifop.com/wp-content/uploads/2018/03/2734-1-study_file.pdf Ifop]\n| rowspan=\"3\" data-sort-value=\"2014-07-22\"| 21–22 Jul 2014\n| rowspan=\"3\"| 947\n| rowspan=\"3\"| –\n| 2%\n| 1%\n| –\n| 10%\n| –\n| 3%\n| 17%\n| –\n| –\n| –\n| 13%\n| –\n| style=\"background:#DFEEFF;\"| 25%\n| –\n| –\n| 3%\n| –\n| style=\"background:#C1CCE1;\"| 26%\n| –\n|-\n| 2%\n| 1%\n| –\n| 11%\n| –\n| 3%\n| –\n| 17%\n| –\n| –\n| 12%\n| –\n| style=\"background:#DFEEFF;\"| 25%\n| –\n| –\n| 3%\n| –\n| style=\"background:#C1CCE1;\"| 26%\n| –\n|-\n| 2%\n| 1%\n| –\n| 11%\n| –\n| 4%\n| –\n| –\n| 10%\n| –\n| 16%\n| –\n| style=\"background:#DFEEFF;\"| 26%\n| –\n| –\n| 3%\n| –\n| style=\"background:#C1CCE1;\"| 27%\n| –\n|-\n| rowspan=\"3\" style=\"background:#FFCCCC;\"| [https://www.ifop.com/wp-content/uploads/2018/03/2608-1-study_file.pdf Ifop]\n| rowspan=\"3\" data-sort-value=\"2014-04-18\"| 15–18 Apr 2014\n| rowspan=\"3\"| 998\n| rowspan=\"3\"| –\n| 0.5%\n| 1.5%\n| –\n| 9%\n| 3%\n| –\n| 18%\n| –\n| –\n| –\n| 10%\n| style=\"background:#B9DAFF;\"| 30%\n| –\n| –\n| –\n| 2%\n| –\n| style=\"background:#E0E5F0;\"| 26%\n| data-sort-value=\"0%\"|  Polls marked with three asterisks (***) from Scan Research/Le Terrain use CATI and random number dialing, unlike all other pollsters, which conduct online surveys using the quota method. The polling commission published notices for each of the two polls conducted by Scan Research/Le Terrain.\nThe publication of second-round polls was prohibited after midnight on 5 May 2017.\nGraphical summary\nThe averages in the graphs below were constructed using polls listed below conducted by the eight major French pollsters. The graphs are smoothed 14-day weighted moving averages, using only the most recent poll conducted by any given pollster within that range (each poll weighted based on recency). The actual votes gave 66,10% to Macron and 33.90% to Le Pen of expressed votes, shown by larger dots on the right side of the curves.\nMacron–Le Pen\n{| class=\"wikitable sortable\" style=\"text-align:center;font-size:90%;line-height:14px;\"\n|- style=\"height:40px;\"\n! style=\"width:100px;\" rowspan=\"2\"| Polling firm\n! style=\"width:110px;\" rowspan=\"2\"| Fieldwork date\n! style=\"width:35px;\" rowspan=\"2\"| Samplesize\n! style=\"width:30px;\" rowspan=\"2\"|\n! class=\"unsortable\" style=\"width:60px;\"| Macron\n! class=\"unsortable\" style=\"width:60px;\"| Le Pen\n|-\n! style=\"background:;\"|\n! style=\"background:;\"|\n|- style=\"background:#E9E9E9;\"\n| 2017 election\n| data-sort-value=\"2017-05-07\"| 7 May 2017\n| –\n| 25.44%\n| style=\"background:#FFED99;\"| 66.10%\n| 33.90%\n|-\n| style=\"background:#04FBF4;\"| [https://www.ipsos.com/sites/default/files/files-fr-fr/doc_associe/rapport_ipsoslemonde5mai.pdf Ipsos]\n| data-sort-value=\"2017-05-05\"| 5 May 2017\n| 5,331\n| 24%\n| style=\"background:#FFED99;\"| 63%\n| 37%\n|-\n| style=\"background:GreenYellow;\"| [http://harris-interactive.fr/wp-content/uploads/sites/6/2017/05/Rapport-Harris-Indeed-Intentions-de-vote-a-lelection-presidentielle-LCP.pdf Harris Interactive]\n| data-sort-value=\"2017-05-05\"| 4–5 May 2017\n| 2,270\n| –\n| style=\"background:#FFED99;\"| 62%\n| 38%\n|-\n| style=\"background:#FFCCCC;\"| [http://dataviz.ifop.com:8080/IFOP_ROLLING/IFOP_05-05-2017.pdf Ifop-Fiducial]\n| data-sort-value=\"2017-05-05\"| 2–5 May 2017\n| 1,861\n| 24.5%\n| style=\"background:#FFED99;\"| 63%\n| 37%\n|-\n| style=\"background:#CAD5F7;\"| [https://elabe.fr/wp-content/uploads/2017/05/04052017_bfmtv_lexpress_intentions-de-vote-presidentielles-vague-13.pdf Elabe]\n| data-sort-value=\"2017-05-04\"| 4 May 2017\n| 1,009\n| 32%\n| style=\"background:#FFED99;\"| 62%\n| 38%\n|-\n| style=\"background:#04FBF4;\"| [https://www.ipsos.com/sites/default/files/files-fr-fr/doc_associe/intention_de_vote_ipsos_ft-rf_-5_mai_2017_def.pdf Ipsos]\n| data-sort-value=\"2017-05-04\"| 4 May 2017\n| 1,605\n| 24%\n| style=\"background:#FFED99;\"| 61.5%\n| 38.5%\n|-\n| style=\"background:#FFCCFF;\"| [http://www.odoxa.fr/wp-content/uploads/2017/05/Intention-de-vote-Odoxa-DentsuConsulting-LePoint-du-5-mai-2017.pdf Odoxa]\n| data-sort-value=\"2017-05-04\"| 4 May 2017\n| 809\n| 25%\n| style=\"background:#FFED99;\"| 62%\n| 38%\n|-\n| style=\"background:aquamarine;\"| [https://web.archive.org/web/20170509210516/http://opinionlab.opinion-way.com/dokumenty/PresiTRACK-OpinionWay-Orpi-semaine-du-1er-au-5-mai.pdf OpinionWay]\n| data-sort-value=\"2017-05-04\"| 2–4 May 2017\n| 2,264\n| –\n| style=\"background:#FFED99;\"| 62%\n| 38%\n|-\n| style=\"background:#FFCCCC;\"| [http://dataviz.ifop.com:8080/IFOP_ROLLING/IFOP_04-05-2017.pdf Ifop-Fiducial]\n| data-sort-value=\"2017-05-04\"| 1–4 May 2017\n| 1,400\n| 25%\n| style=\"background:#FFED99;\"| 61%\n| 39%\n|-\n| style=\"background:GreenYellow;\"| [http://harris-interactive.fr/wp-content/uploads/sites/6/2017/05/Rapport-Harris-Indeed-Intentions-de-vote-a-lelection-presidentielle-LCP.pdf Harris Interactive]\n| data-sort-value=\"2017-05-03\"| 2–3 May 2017\n| 2,349\n| –\n| style=\"background:#FFED99;\"| 61%\n| 39%\n|-\n| style=\"background:aquamarine;\"| [https://web.archive.org/web/20170509210516/http://opinionlab.opinion-way.com/dokumenty/PresiTRACK-OpinionWay-Orpi-semaine-du-1er-au-5-mai.pdf OpinionWay]\n| data-sort-value=\"2017-05-03\"| 1–3 May 2017\n| 2,264\n| –\n| style=\"background:#FFED99;\"| 61%\n| 39%\n|-\n| style=\"background:#FFCCCC;\"| [http://dataviz.ifop.com:8080/IFOP_ROLLING/IFOP_03-05-2017.pdf Ifop-Fiducial]\n| data-sort-value=\"2017-05-03\"| 30 Apr–3 May 2017\n| 1,405\n| 26%\n| style=\"background:#FFED99;\"| 60%\n| 40%\n|-\n| style=\"background:#FFDFCC;\"| [http://www.bva.fr/data/sondage/sondage_fiche/1983/fichier_intentions_de_vote_-_vague_21_-_pop2017_-_02_mai_2017_-_presentation3185f.pdf BVA]\n| data-sort-value=\"2017-05-02\"| 1–2 May 2017\n| 1,012\n| 20%\n| style=\"background:#FFED99;\"| 60%\n| 40%\n|-\n| style=\"background:aquamarine;\"| [https://web.archive.org/web/20170509210516/http://opinionlab.opinion-way.com/dokumenty/PresiTRACK-OpinionWay-Orpi-semaine-du-1er-au-5-mai.pdf OpinionWay]\n| data-sort-value=\"2017-05-02\"| 30 Apr–2 May 2017\n| 1,936\n| –\n| style=\"background:#FFED99;\"| 60%\n| 40%\n|-\n| style=\"background:#CAD5F7;\"| [https://www.slideshare.net/contactElabe/intentions-de-vote-prsidentielles-vague-12 Elabe]\n| data-sort-value=\"2017-05-02\"| 28 Apr–2 May 2017\n| 3,817\n| 32%\n| style=\"background:#FFED99;\"| 59%\n| 41%\n|-\n| style=\"background:#FFCCCC;\"| [http://dataviz.ifop.com:8080/IFOP_ROLLING/IFOP_02-05-2017.pdf Ifop-Fiducial]\n| data-sort-value=\"2017-05-02\"| 28 Apr–2 May 2017\n| 1,388\n| 27%\n| style=\"background:#FFED99;\"| 59.5%\n| 40.5%\n|-\n| style=\"background:#04FBF4;\"| [https://www.ipsos.com/sites/default/files/files-fr-fr/doc_associe/publication_rapport_eef2017_-_vague14_cevipof_ipsos_le_monde.pdf Ipsos]\n| data-sort-value=\"2017-05-01\"| 30 Apr–1 May 2017\n| 8,936\n| 24%\n| style=\"background:#FFED99;\"| 59%\n| 41%\n|-\n| style=\"background:aquamarine;\"| [https://web.archive.org/web/20170509210516/http://opinionlab.opinion-way.com/dokumenty/PresiTRACK-OpinionWay-Orpi-semaine-du-1er-au-5-mai.pdf OpinionWay]\n| data-sort-value=\"2017-05-01\"| 29 Apr–1 May 2017\n| 1,764\n| –\n| style=\"background:#FFED99;\"| 60%\n| 40%\n|-\n| style=\"background:#FFCCCC;\"| [http://dataviz.ifop.com:8080/IFOP_ROLLING/IFOP_01-05-2017.pdf Ifop-Fiducial]\n| data-sort-value=\"2017-05-01\"| 27 Apr–1 May 2017\n| 1,385\n| 28%\n| style=\"background:#FFED99;\"| 59%\n| 41%\n|-\n| style=\"background:burlywood;\"| [https://fr.kantar.com/elections/presidentielle/2017/intentions-de-vote-des-francais-au-2nd-tour-de-l-election-presidentielle/ Kantar Sofres]\n| data-sort-value=\"2017-04-30\"| 28–30 Apr 2017\n| 1,031\n| –\n| style=\"background:#FFED99;\"| 59%\n| 41%\n|-\n| style=\"background:aquamarine;\"| [https://web.archive.org/web/20170509210516/http://opinionlab.opinion-way.com/dokumenty/PresiTRACK-OpinionWay-Orpi-semaine-du-1er-au-5-mai.pdf OpinionWay]\n| data-sort-value=\"2017-04-30\"| 28–30 Apr 2017\n| 1,488\n| –\n| style=\"background:#FFED99;\"| 61%\n| 39%\n|-\n| style=\"background:#04FBF4;\"| [https://www.ipsos.com/sites/default/files/files-fr-fr/doc_associe/rapport_entre2tours_v2.pdf Ipsos]\n| data-sort-value=\"2017-04-29\"| 28–29 Apr 2017\n| 918\n| 25%\n| style=\"background:#FFED99;\"| 60%\n| 40%\n|-\n| style=\"background:#FFDFCC;\"| [http://www.bva.fr/data/sondage/sondage_fiche/1982/fichier_intentions_de_vote_-_vague_20_-_pop2017_-_28_avril_2017_-_presentation886c1.pdf BVA]\n| data-sort-value=\"2017-04-28\"| 26–28 Apr 2017\n| 944\n| 22%\n| style=\"background:#FFED99;\"| 59%\n| 41%\n|-\n| style=\"background:#FFCCCC;\"| [http://dataviz.ifop.com:8080/IFOP_ROLLING/IFOP_28-04-2017.pdf Ifop-Fiducial]\n| data-sort-value=\"2017-04-28\"| 25–28 Apr 2017\n| 1,399\n| 29%\n| style=\"background:#FFED99;\"| 60%\n| 40%\n|-\n| style=\"background:#FFCCFF;\"| [http://www.odoxa.fr/wp-content/uploads/2017/04/Intention-de-vote-presidentielle-2nd-tour-Odoxa-LePoint_280417_ok-1.pdf Odoxa]\n| data-sort-value=\"2017-04-27\"| 26–27 Apr 2017\n| 803\n| –\n| style=\"background:#FFED99;\"| 59%\n| 41%\n|-\n| style=\"background:GreenYellow;\"| [http://harris-interactive.fr/wp-content/uploads/sites/6/2017/04/Rapport-Harris-Indeed-Intentions-de-vote-a-lelection-presidentielle-LCP.pdf Harris Interactive]\n| data-sort-value=\"2017-04-27\"| 25–27 Apr 2017\n| 940\n| –\n| style=\"background:#FFED99;\"| 61%\n| 39%\n|-\n| style=\"background:aquamarine;\"| [https://web.archive.org/web/20170509210526/http://opinionlab.opinion-way.com/dokumenty/PresiTRACK-OpinionWay-Orpi-Resultatsdelasemainedu24au28avril.pdf OpinionWay]\n| data-sort-value=\"2017-04-27\"| 25–27 Apr 2017\n| 1,790\n| –\n| style=\"background:#FFED99;\"| 60%\n| 40%\n|-\n| style=\"background:#FFCCCC;\"| [http://dataviz.ifop.com:8080/IFOP_ROLLING/IFOP_27-04-2017.pdf Ifop-Fiducial]\n| data-sort-value=\"2017-04-27\"| 24–27 Apr 2017\n| 1,407\n| 29%\n| style=\"background:#FFED99;\"| 60.5%\n| 39.5%\n|-\n| style=\"background:aquamarine;\"| [https://web.archive.org/web/20170509210526/http://opinionlab.opinion-way.com/dokumenty/PresiTRACK-OpinionWay-Orpi-Resultatsdelasemainedu24au28avril.pdf OpinionWay]\n| data-sort-value=\"2017-04-26\"| 24–26 Apr 2017\n| 1,800\n| –\n| style=\"background:#FFED99;\"| 59%\n| 41%\n|-\n| style=\"background:#FFCCCC;\"| [http://dataviz.ifop.com:8080/IFOP_ROLLING/IFOP_26-04-2017.pdf Ifop-Fiducial]\n| data-sort-value=\"2017-04-26\"| 23–26 Apr 2017\n| 1,893\n| 28%\n| style=\"background:#FFED99;\"| 60.5%\n| 39.5%\n|-\n| style=\"background:#FFCCFF;\"| [http://www.odoxa.fr/wp-content/uploads/2017/04/Intention-de-vote-presidentielle-2nd-tour-Odoxa-LePoint_280417_ok-1.pdf Odoxa]\n| data-sort-value=\"2017-04-25\"| 24–25 Apr 2017\n| 1,000\n| –\n| style=\"background:#FFED99;\"| 63%\n| 37%\n|-\n| style=\"background:#FFCCCC;\"| [http://dataviz.ifop.com:8080/IFOP_ROLLING/IFOP_25-04-2017.pdf Ifop-Fiducial]\n| data-sort-value=\"2017-04-25\"| 23–25 Apr 2017\n| 1,416\n| 27%\n| style=\"background:#FFED99;\"| 61%\n| 39%\n|-\n| style=\"background:aquamarine;\"| [https://web.archive.org/web/20170509210526/http://opinionlab.opinion-way.com/dokumenty/PresiTRACK-OpinionWay-Orpi-Resultatsdelasemainedu24au28avril.pdf OpinionWay]\n| data-sort-value=\"2017-04-25\"| 23–25 Apr 2017\n| 2,828\n| –\n| style=\"background:#FFED99;\"| 60%\n| 40%\n|-\n| style=\"background:#CAD5F7;\"| [https://elabe.fr/wp-content/uploads/2017/04/24042017_bfmtv_lexpress_intentions-de-vote-presidentielles-vague-11-avec-synthese.pdf Elabe]\n| data-sort-value=\"2017-04-24\"| 24 Apr 2017\n| 967\n| 31%\n| style=\"background:#FFED99;\"| 64%\n| 36%\n|-\n| style=\"background:#FFCCCC;\"| [http://dataviz.ifop.com:8080/IFOP_ROLLING/IFOP_24-04-2017.pdf Ifop-Fiducial]\n| data-sort-value=\"2017-04-24\"| 23–24 Apr 2017\n| 846\n| 26%\n| style=\"background:#FFED99;\"| 60%\n| 40%\n|-\n| style=\"background:aquamarine;\"| [https://web.archive.org/web/20170509210526/http://opinionlab.opinion-way.com/dokumenty/PresiTRACK-OpinionWay-Orpi-Resultatsdelasemainedu24au28avril.pdf OpinionWay]\n| data-sort-value=\"2017-04-24\"| 23–24 Apr 2017\n| 2,222\n| –\n| style=\"background:#FFED99;\"| 61%\n| 39%\n|-\n| style=\"background:aquamarine;\"| [https://web.archive.org/web/20170509210526/http://opinionlab.opinion-way.com/dokumenty/PresiTRACK-OpinionWay-Orpi-Resultatsdelasemainedu24au28avril.pdf OpinionWay]\n| data-sort-value=\"2017-04-24\"| 23–24 Apr 2017\n| 1,461\n| –\n| style=\"background:#FFED99;\"| 61%\n| 39%\n|-\n| style=\"background:GreenYellow;\"| [http://harris-interactive.fr/wp-content/uploads/sites/6/2017/04/Rapport-Harris-Sondage-Soir-du-Vote-1er-tour-de-lelection-presidentielle-M6.pdf Harris Interactive]\n| data-sort-value=\"2017-04-23\"| 23 Apr 2017\n| 2,684\n| –\n| style=\"background:#FFED99;\"| 64%\n| 36%\n|-\n| style=\"background:#04FBF4;\"| [https://www.ipsos.com/sites/default/files/files-fr-fr/doc_associe/ipsos_sopra_steria_les_francais_et_le_2nd_tour_macron-le_pen_23_avril_20.pdf Ipsos]\n| data-sort-value=\"2017-04-23\"| 23 Apr 2017\n| 1,379\n| –\n| style=\"background:#FFED99;\"| 62%\n| 38%\n|-\n| style=\"background:#FFCCFF;\"| [http://www.odoxa.fr/wp-content/uploads/2017/04/Intention-de-vote-presidentielle-Odoxa-LePoint_210417.pdf Odoxa]\n| data-sort-value=\"2017-04-21\"| 21 Apr 2017\n| 774\n| –\n| style=\"background:#FFED99;\"| 62%\n| 38%\n|-\n| style=\"background:#FFCCCC;\"| [http://dataviz.ifop.com:8080/IFOP_ROLLING/IFOP_21-04-2017.pdf Ifop-Fiducial]\n| data-sort-value=\"2017-04-21\"| 18–21 Apr 2017\n| 2,823\n| –\n| style=\"background:#FFED99;\"| 60.5%\n| 39.5%\n|-\n| style=\"background:#FFCCFF;\"| [http://www.odoxa.fr/wp-content/uploads/2017/04/Intention-de-vote-presidentielle-Odoxa-LePoint_210417.pdf Odoxa]\n| data-sort-value=\"2017-04-20\"| 20 Apr 2017\n| 1,433\n| –\n| style=\"background:#FFED99;\"| 65%\n| 35%\n|-\n| style=\"background:#CAD5F7;\"| [https://elabe.fr/wp-content/uploads/2017/04/20042017_bfmtv_lexpress_intentions-de-vote-presidentielles-vague-10.pdf Elabe]\n| data-sort-value=\"2017-04-20\"| 19–20 Apr 2017\n| 1,445\n| –\n| style=\"background:#FFED99;\"| 65%\n| 35%\n|-\n| style=\"background:GreenYellow;\"| [http://harris-interactive.fr/wp-content/uploads/sites/6/2017/04/rapport-Harris-Indeed-Intentions-vote-election-presidentielle-LCP.pdf Harris Interactive]\n| data-sort-value=\"2017-04-20\"| 18–20 Apr 2017\n| 962\n| –\n| style=\"background:#FFED99;\"| 67%\n| 33%\n|-\n| style=\"background:aquamarine;\"| [https://web.archive.org/web/20170422041348/http://opinionlab.opinion-way.com/dokumenty/PresiTRACK-OpinionWay-Orpi-Resultatsdelasemainedu17au21avril.pdf OpinionWay]\n| data-sort-value=\"2017-04-20\"| 18–20 Apr 2017\n| 2,269\n| –\n| style=\"background:#FFED99;\"| 64%\n| 36%\n|-\n| style=\"background:#FFCCCC;\"| [http://dataviz.ifop.com:8080/IFOP_ROLLING/IFOP_20-04-2017.pdf Ifop-Fiducial]\n| data-sort-value=\"2017-04-20\"| 17–20 Apr 2017\n| 2,810\n| –\n| style=\"background:#FFED99;\"| 61%\n| 39%\n|-\n| style=\"background:#FFDFCC;\"| [http://www.bva.fr/data/sondage/sondage_fiche/1978/fichier_intentions_de_vote_-_vague_18_-_pop2017_-_19_avril_2017_-_presentation5e34d.pdf BVA]\n| data-sort-value=\"2017-04-19\"| 18–19 Apr 2017\n| 947\n| –\n| style=\"background:#FFED99;\"| 65%\n| 35%\n|-\n| style=\"background:GreenYellow;\"| [http://harris-interactive.fr/wp-content/uploads/sites/6/2017/04/Rapport-Harris-intentions-vote-presidentielle-france-televisions-20042017.pdf Harris Interactive]\n| data-sort-value=\"2017-04-19\"| 18–19 Apr 2017\n| 2,812\n| –\n| style=\"background:#FFED99;\"| 66%\n| 34%\n|-\n| style=\"background:aquamarine;\"| [https://web.archive.org/web/20170422041348/http://opinionlab.opinion-way.com/dokumenty/PresiTRACK-OpinionWay-Orpi-Resultatsdelasemainedu17au21avril.pdf OpinionWay]\n| data-sort-value=\"2017-04-19\"| 17–19 Apr 2017\n| 2,394\n| –\n| style=\"background:#FFED99;\"| 65%\n| 35%\n|-\n| style=\"background:#FFCCCC;\"| [http://dataviz.ifop.com:8080/IFOP_ROLLING/IFOP_19-04-2017.pdf Ifop-Fiducial]\n| data-sort-value=\"2017-04-19\"| 16–19 Apr 2017\n| 2,792\n| –\n| style=\"background:#FFED99;\"| 60.5%\n| 39.5%\n|-\n| style=\"background:aquamarine;\"| [https://web.archive.org/web/20170422041348/http://opinionlab.opinion-way.com/dokumenty/PresiTRACK-OpinionWay-Orpi-Resultatsdelasemainedu17au21avril.pdf OpinionWay]\n| data-sort-value=\"2017-04-18\"| 16–18 Apr 2017\n| 2,417\n| –\n| style=\"background:#FFED99;\"| 65%\n| 35%\n|-\n| style=\"background:#FFCCCC;\"| [http://dataviz.ifop.com:8080/IFOP_ROLLING/IFOP_18-04-2017.pdf Ifop-Fiducial]\n| data-sort-value=\"2017-04-18\"| 14–18 Apr 2017\n| 2,804\n| –\n| style=\"background:#FFED99;\"| 60.5%\n| 39.5%\n|-\n| style=\"background:#CAD5F7;\"| [https://elabe.fr/wp-content/uploads/2017/04/17042017_bfmtv_lexpress_intentions-de-vote-presidentielles-vague-9.pdf Elabe]\n| data-sort-value=\"2017-04-17\"| 16–17 Apr 2017\n| 1,438\n| –\n| style=\"background:#FFED99;\"| 62%\n| 38%\n|-\n| style=\"background:#04FBF4;\"| [https://www.ipsos.com/sites/default/files/files-fr-fr/doc_associe/rapport_vague13.pdf Ipsos]\n| data-sort-value=\"2017-04-17\"| 16–17 Apr 2017\n| 8,274\n| –\n| style=\"background:#FFED99;\"| 61%\n| 39%\n|-\n| style=\"background:aquamarine;\"| [https://web.archive.org/web/20170422041348/http://opinionlab.opinion-way.com/dokumenty/PresiTRACK-OpinionWay-Orpi-Resultatsdelasemainedu17au21avril.pdf OpinionWay]\n| data-sort-value=\"2017-04-17\"| 15–17 Apr 2017\n| 2,423\n| –\n| style=\"background:#FFED99;\"| 64%\n| 36%\n|-\n| style=\"background:burlywood;\"| [https://fr.kantar.com/elections/presidentielle/2017/intentions-de-vote-l-hypothese-d-un-match-a-quatre-se-confirme/ Kantar Sofres]\n| data-sort-value=\"2017-04-17\"| 14–17 Apr 2017\n| 982\n| –\n| style=\"background:#FFED99;\"| 61%\n| 39%\n|-\n| style=\"background:#FFCCCC;\"| [http://dataviz.ifop.com:8080/IFOP_ROLLING/IFOP_17-04-2017.pdf Ifop-Fiducial]\n| data-sort-value=\"2017-04-17\"| 13–17 Apr 2017\n| 2,796\n| –\n| style=\"background:#FFED99;\"| 60%\n| 40%\n|-\n| style=\"background:aquamarine;\"| [https://web.archive.org/web/20170422041348/http://opinionlab.opinion-way.com/dokumenty/PresiTRACK-OpinionWay-Orpi-Resultatsdelasemainedu17au21avril.pdf OpinionWay]\n| data-sort-value=\"2017-04-16\"| 14–16 Apr 2017\n| 2,168\n| –\n| style=\"background:#FFED99;\"| 64%\n| 36%\n|-\n| style=\"background:#FFFFFF;\"| [https://blogleterrain.wordpress.com/2017/04/17/jl-melenchon-devance-de-peu-m-le-pen/ Le Terrain]***\n| data-sort-value=\"2017-04-15\"| 13–15 Apr 2017\n| 642\n| –\n| style=\"background:#FFED99;\"| 71%\n| 29%\n|-\n| style=\"background:#FFDFCC;\"| [https://www.bva-group.com/wp-content/uploads/2017/04/Intentions-de-vote-Vague-17-POP2017-14-avril-2017-Pr%C3%A9sentation.pdf BVA]\n| data-sort-value=\"2017-04-14\"| 12–14 Apr 2017\n| 918\n| –\n| style=\"background:#FFED99;\"| 64%\n| 36%\n|-\n| style=\"background:#FFCCCC;\"| [http://dataviz.ifop.com:8080/IFOP_ROLLING/IFOP_14-04-2017.pdf Ifop-Fiducial]\n| data-sort-value=\"2017-04-14\"| 11–14 Apr 2017\n| 2,776\n| –\n| style=\"background:#FFED99;\"| 59%\n| 41%\n|-\n| style=\"background:#04FBF4;\"| [https://www.ipsos.com/sites/default/files/files-fr-fr/doc_associe/enquete_presidentielle_ipsos_le_monde.pdf Ipsos]\n| data-sort-value=\"2017-04-13\"| 12–13 Apr 2017\n| 927\n| –\n| style=\"background:#FFED99;\"| 63%\n| 37%\n|-\n| style=\"background:#FFCCFF;\"| [http://www.odoxa.fr/wp-content/uploads/2017/04/Intention-de-vote-presidentielle-Dentsu-Consulting-LePoint_140417.pdf Odoxa]\n| data-sort-value=\"2017-04-13\"| 12–13 Apr 2017\n| 732\n| –\n| style=\"background:#FFED99;\"| 61%\n| 39%\n|-\n| style=\"background:GreenYellow;\"| [http://harris-interactive.fr/wp-content/uploads/sites/6/2017/04/Rapport-Harris-Indeed-Intentions-vote-election-presidentielle-LCP.pdf Harris Interactive]\n| data-sort-value=\"2017-04-13\"| 11–13 Apr 2017\n| 904\n| –\n| style=\"background:#FFED99;\"| 67%\n| 33%\n|-\n| style=\"background:aquamarine;\"| [https://web.archive.org/web/20170415012050/http://opinionlab.opinion-way.com/dokumenty/PresiTRACK-OpinionWay-Orpi-Resultatsdu10au14avril.pdf OpinionWay]\n| data-sort-value=\"2017-04-13\"| 11–13 Apr 2017\n| 1,443\n| –\n| style=\"background:#FFED99;\"| 62%\n| 38%\n|-\n| style=\"background:#FFCCCC;\"| [http://dataviz.ifop.com:8080/IFOP_ROLLING/IFOP_13-04-2017.pdf Ifop-Fiducial]\n| data-sort-value=\"2017-04-13\"| 10–13 Apr 2017\n| 2,797\n| –\n| style=\"background:#FFED99;\"| 58.5%\n| 41.5%\n|-\n| style=\"background:#CAD5F7;\"| [https://elabe.fr/wp-content/uploads/2017/04/13042017_les_echos_radio_classique_intentions-de-vote-presidentielles.pdf Elabe]\n| data-sort-value=\"2017-04-12\"| 11–12 Apr 2017\n| 1,010\n| –\n| style=\"background:#FFED99;\"| 65%\n| 35%\n|-\n| style=\"background:aquamarine;\"| [https://web.archive.org/web/20170415012050/http://opinionlab.opinion-way.com/dokumenty/PresiTRACK-OpinionWay-Orpi-Resultatsdu10au14avril.pdf OpinionWay]\n| data-sort-value=\"2017-04-12\"| 10–12 Apr 2017\n| 1,423\n| –\n| style=\"background:#FFED99;\"| 63%\n| 37%\n|-\n| style=\"background:#FFCCCC;\"| [http://dataviz.ifop.com:8080/IFOP_ROLLING/IFOP_12-04-2017.pdf Ifop-Fiducial]\n| data-sort-value=\"2017-04-12\"| 9–12 Apr 2017\n| 2,800\n| –\n| style=\"background:#FFED99;\"| 58.5%\n| 41.5%\n|-\n| style=\"background:aquamarine;\"| [https://web.archive.org/web/20170415012050/http://opinionlab.opinion-way.com/dokumenty/PresiTRACK-OpinionWay-Orpi-Resultatsdu10au14avril.pdf OpinionWay]\n| data-sort-value=\"2017-04-11\"| 9–11 Apr 2017\n| 1,395\n| –\n| style=\"background:#FFED99;\"| 62%\n| 38%\n|-\n| style=\"background:#FFCCCC;\"| [http://dataviz.ifop.com:8080/IFOP_ROLLING/IFOP_11-04-2017.pdf Ifop-Fiducial]\n| data-sort-value=\"2017-04-11\"| 7–11 Apr 2017\n| 2,806\n| –\n| style=\"background:#FFED99;\"| 58.5%\n| 41.5%\n|-\n| style=\"background:#CAD5F7;\"| [https://elabe.fr/wp-content/uploads/2017/04/11042017_bfmtv_lexpress_intentions-de-vote-presidentielles-vague-8.pdf Elabe]\n| data-sort-value=\"2017-04-10\"| 9–10 Apr 2017\n| 1,002\n| –\n| style=\"background:#FFED99;\"| 64%\n| 36%\n|-\n| style=\"background:aquamarine;\"| [https://web.archive.org/web/20170415012050/http://opinionlab.opinion-way.com/dokumenty/PresiTRACK-OpinionWay-Orpi-Resultatsdu10au14avril.pdf OpinionWay]\n| data-sort-value=\"2017-04-10\"| 8–10 Apr 2017\n| 1,498\n| –\n| style=\"background:#FFED99;\"| 63%\n| 37%\n|-\n| style=\"background:#FFCCCC;\"| [http://dataviz.ifop.com:8080/IFOP_ROLLING/IFOP_10-04-2017.pdf Ifop-Fiducial]\n| data-sort-value=\"2017-04-10\"| 6–10 Apr 2017\n| 2,616\n| –\n| style=\"background:#FFED99;\"| 58%\n| 42%\n|-\n| style=\"background:#04FBF4;\"| [https://www.ipsos.com/sites/default/files/files-fr-fr/doc_associe/notice-technique-etat-desprit-francais-ipsos-ft-rf-1004.pdf Ipsos]\n| data-sort-value=\"2017-04-09\"| 7–9 Apr 2017\n| 1,002\n| –\n| style=\"background:#FFED99;\"| 62%\n| 38%\n|-\n| style=\"background:aquamarine;\"| [https://web.archive.org/web/20170415012050/http://opinionlab.opinion-way.com/dokumenty/PresiTRACK-OpinionWay-Orpi-Resultatsdu10au14avril.pdf OpinionWay]\n| data-sort-value=\"2017-04-09\"| 7–9 Apr 2017\n| 1,565\n| –\n| style=\"background:#FFED99;\"| 62%\n| 38%\n|-\n| style=\"background:#FFDFCC;\"| [http://www.bva.fr/data/sondage/sondage_fiche/1977/fichier_intentions_de_vote_-_vague_16_-_pop2017_-_8_avril_2017_-_presentationbbd1d.pdf BVA]\n| data-sort-value=\"2017-04-07\"| 5–7 Apr 2017\n| 861\n| –\n| style=\"background:#FFED99;\"| 61%\n| 39%\n|-\n| style=\"background:burlywood;\"| [https://fr.kantar.com/elections/presidentielle/2017/intentions-de-vote-forte-percee-de-jean-luc-melenchon/ Kantar Sofres]\n| data-sort-value=\"2017-04-07\"| 5–7 Apr 2017\n| 934\n| –\n| style=\"background:#FFED99;\"| 61%\n| 39%\n|-\n| style=\"background:#FFCCCC;\"| [http://dataviz.ifop.com:8080/IFOP_ROLLING/IFOP_07-04-2017.pdf Ifop-Fiducial]\n| data-sort-value=\"2017-04-07\"| 4–7 Apr 2017\n| 2,246\n| –\n| style=\"background:#FFED99;\"| 59%\n| 41%\n|-\n| style=\"background:GreenYellow;\"| [http://harris-interactive.fr/wp-content/uploads/sites/6/2017/04/Rapport-Harris-Intentions-vote-election-presidentielle-LCP.pdf Harris Interactive]\n| data-sort-value=\"2017-04-06\"| 5–6 Apr 2017\n| 928\n| –\n| style=\"background:#FFED99;\"| 63%\n| 37%\n|-\n| style=\"background:aquamarine;\"| [https://web.archive.org/web/20170408171349/http://opinionlab.opinion-way.com/dokumenty/PresiTRACK-OpinionWay-Orpi-Resultats-semaine-3au7avril.pdf OpinionWay]\n| data-sort-value=\"2017-04-06\"| 4–6 Apr 2017\n| 1,589\n| –\n| style=\"background:#FFED99;\"| 62%\n| 38%\n|-\n| style=\"background:#FFCCCC;\"| [http://dataviz.ifop.com:8080/IFOP_ROLLING/IFOP_06-04-2017.pdf Ifop-Fiducial]\n| data-sort-value=\"2017-04-06\"| 3–6 Apr 2017\n| 2,243\n| –\n| style=\"background:#FFED99;\"| 60%\n| 40%\n|-\n| style=\"background:#CAD5F7;\"| [https://elabe.fr/wp-content/uploads/2017/04/05042017_bfmtv_lexpress_intentions-de-vote-presidentielles-vague-7.pdf Elabe]\n| data-sort-value=\"2017-04-05\"| 5 Apr 2017\n| 995\n| –\n| style=\"background:#FFED99;\"| 62%\n| 38%\n|-\n| style=\"background:GreenYellow;\"| [http://harris-interactive.fr/wp-content/uploads/sites/6/2017/04/Rapport-Harris-Intentions-de-vote-a-lelection-presidentielle-France-TV.pdf Harris Interactive]\n| data-sort-value=\"2017-04-05\"| 5 Apr 2017\n| 2,097\n| –\n| style=\"background:#FFED99;\"| 62%\n| 38%\n|-\n| style=\"background:#FFCCFF;\"| [http://www.odoxa.fr/wp-content/uploads/2017/04/Intention-de-vote-presidentielle-Dentsu-Consulting-LePoint-07-04-17_15h.pdf Odoxa]\n| data-sort-value=\"2017-04-05\"| 5 Apr 2017\n| 766\n| –\n| style=\"background:#FFED99;\"| 61%\n| 39%\n|-\n| style=\"background:GreenYellow;\"| [http://harris-interactive.fr/wp-content/uploads/sites/6/2017/04/Rapport-Harris-Intentions-de-vote-a-lelection-presidentielle-France-TV.pdf Harris Interactive]\n| data-sort-value=\"2017-04-04\"| 3–4 Apr 2017\n| 3,639\n| –\n| style=\"background:#FFED99;\"| 62%\n| 38%\n|-\n| style=\"background:aquamarine;\"| [https://web.archive.org/web/20170408171349/http://opinionlab.opinion-way.com/dokumenty/PresiTRACK-OpinionWay-Orpi-Resultats-semaine-3au7avril.pdf OpinionWay]\n| data-sort-value=\"2017-04-05\"| 3–5 Apr 2017\n| 1,553\n| –\n| style=\"background:#FFED99;\"| 60%\n| 40%\n|-\n| style=\"background:#FFCCCC;\"| [http://dataviz.ifop.com:8080/IFOP_ROLLING/IFOP_05-04-2017.pdf Ifop-Fiducial]\n| data-sort-value=\"2017-04-05\"| 2–5 Apr 2017\n| 2,245\n| –\n| style=\"background:#FFED99;\"| 59.5%\n| 40.5%\n|-\n| style=\"background:aquamarine;\"| [https://web.archive.org/web/20170408171349/http://opinionlab.opinion-way.com/dokumenty/PresiTRACK-OpinionWay-Orpi-Resultats-semaine-3au7avril.pdf OpinionWay]\n| data-sort-value=\"2017-04-04\"| 2–4 Apr 2017\n| 1,541\n| –\n| style=\"background:#FFED99;\"| 60%\n| 40%\n|-\n| style=\"background:#FFCCCC;\"| [http://dataviz.ifop.com:8080/IFOP_ROLLING/IFOP_04-04-2017.pdf Ifop-Fiducial]\n| data-sort-value=\"2017-04-04\"| 31 Mar–4 Apr 2017\n| 2,254\n| –\n| style=\"background:#FFED99;\"| 60.5%\n| 39.5%\n|-\n| style=\"background:aquamarine;\"| [https://web.archive.org/web/20170408171349/http://opinionlab.opinion-way.com/dokumenty/PresiTRACK-OpinionWay-Orpi-Resultats-semaine-3au7avril.pdf OpinionWay]\n| data-sort-value=\"2017-04-03\"| 1–3 Apr 2017\n| 1,583\n| –\n| style=\"background:#FFED99;\"| 61%\n| 39%\n|-\n| style=\"background:#FFCCCC;\"| [http://dataviz.ifop.com:8080/IFOP_ROLLING/IFOP_03-04-2017.pdf Ifop-Fiducial]\n| data-sort-value=\"2017-04-03\"| 30 Mar–3 Apr 2017\n| 2,232\n| –\n| style=\"background:#FFED99;\"| 60%\n| 40%\n|-\n| style=\"background:#04FBF4;\"| [https://www.ipsos.com/sites/default/files/files-fr-fr/doc_associe/cevipof_vague12bis.pdf Ipsos]\n| data-sort-value=\"2017-04-02\"| 31 Mar–2 Apr 2017\n| 9,460\n| –\n| style=\"background:#FFED99;\"| 61%\n| 39%\n|-\n| style=\"background:aquamarine;\"| [https://web.archive.org/web/20170408171349/http://opinionlab.opinion-way.com/dokumenty/PresiTRACK-OpinionWay-Orpi-Resultats-semaine-3au7avril.pdf OpinionWay]\n| data-sort-value=\"2017-04-02\"| 31 Mar–2 Apr 2017\n| 1,624\n| –\n| style=\"background:#FFED99;\"| 63%\n| 37%\n|-\n| style=\"background:#FFCCCC;\"| [http://dataviz.ifop.com:8080/IFOP_ROLLING/IFOP_31-03-2017.pdf Ifop-Fiducial]\n| data-sort-value=\"2017-03-31\"| 28–31 Mar 2017\n| 2,204\n| –\n| style=\"background:#FFED99;\"| 60%\n| 40%\n|-\n| style=\"background:#FFDFCC;\"| [http://www.bva.fr/data/sondage/sondage_fiche/1974/fichier_intentions_de_vote_-_vague_15_-_pop2017_-_1er_avril_2017_-_presentation70fea.pdf BVA]\n| data-sort-value=\"2017-03-30\"| 29–30 Mar 2017\n| 872\n| –\n| style=\"background:#FFED99;\"| 60%\n| 40%\n|-\n| style=\"background:#FFCCFF;\"| [http://www.odoxa.fr/wp-content/uploads/2017/03/Intention-de-vote-presidentielle-Dentsu-Consulting-LePoint-31-03-17.pdf Odoxa]\n| data-sort-value=\"2017-03-30\"| 29–30 Mar 2017\n| 753\n| –\n| style=\"background:#FFED99;\"| 59%\n| 41%\n|-\n| style=\"background:aquamarine;\"| [https://web.archive.org/web/20170404220730/http://opinionlab.opinion-way.com/dokumenty/Presitrack-synthese-27au31mars.pdf OpinionWay]\n| data-sort-value=\"2017-03-30\"| 28–30 Mar 2017\n| 1,609\n| –\n| style=\"background:#FFED99;\"| 63%\n| 37%\n|-\n| style=\"background:#FFCCCC;\"| [http://dataviz.ifop.com:8080/IFOP_ROLLING/IFOP_30-03-2017.pdf Ifop-Fiducial]\n| data-sort-value=\"2017-03-30\"| 27–30 Mar 2017\n| 2,215\n| –\n| style=\"background:#FFED99;\"| 60%\n| 40%\n|-\n| style=\"background:#CAD5F7;\"| [https://elabe.fr/wp-content/uploads/2017/03/29032017_bfmtv_lexpress_intentions-de-vote-presidentielles-vague-6.pdf Elabe]\n| data-sort-value=\"2017-03-29\"| 28–29 Mar 2017\n| 998\n| –\n| style=\"background:#FFED99;\"| 63%\n| 37%\n|-\n| style=\"background:aquamarine;\"| [https://web.archive.org/web/20170404220730/http://opinionlab.opinion-way.com/dokumenty/Presitrack-synthese-27au31mars.pdf OpinionWay]\n| data-sort-value=\"2017-03-29\"| 27–29 Mar 2017\n| 1,636\n| –\n| style=\"background:#FFED99;\"| 64%\n| 36%\n|-\n| style=\"background:#FFCCCC;\"| [http://dataviz.ifop.com:8080/IFOP_ROLLING/IFOP_29-03-2017.pdf Ifop-Fiducial]\n| data-sort-value=\"2017-03-29\"| 26–29 Mar 2017\n| 2,241\n| –\n| style=\"background:#FFED99;\"| 60%\n| 40%\n|-\n| style=\"background:aquamarine;\"| [https://web.archive.org/web/20170404220730/http://opinionlab.opinion-way.com/dokumenty/Presitrack-synthese-27au31mars.pdf OpinionWay]\n| data-sort-value=\"2017-03-28\"| 26–28 Mar 2017\n| 1,618\n| –\n| style=\"background:#FFED99;\"| 64%\n| 36%\n|-\n| style=\"background:#FFCCCC;\"| [http://dataviz.ifop.com:8080/IFOP_ROLLING/IFOP_28-03-2017.pdf Ifop-Fiducial]\n| data-sort-value=\"2017-03-28\"| 24–28 Mar 2017\n| 2,231\n| –\n| style=\"background:#FFED99;\"| 60%\n| 40%\n|-\n| style=\"background:#04FBF4;\"| [https://www.ipsos.com/sites/default/files/files-fr-fr/doc_associe/enquetepresidentielle1v4_1.pdf Ipsos]\n| data-sort-value=\"2017-03-27\"| 25–27 Mar 2017\n| 1,005\n| –\n| style=\"background:#FFED99;\"| 62%\n| 38%\n|-\n| style=\"background:aquamarine;\"| [https://web.archive.org/web/20170404220730/http://opinionlab.opinion-way.com/dokumenty/Presitrack-synthese-27au31mars.pdf OpinionWay]\n| data-sort-value=\"2017-03-27\"| 25–27 Mar 2017\n| 1,599\n| –\n| style=\"background:#FFED99;\"| 62%\n| 38%\n|-\n| style=\"background:#FFCCCC;\"| [http://dataviz.ifop.com:8080/IFOP_ROLLING/IFOP_27-03-2017.pdf Ifop-Fiducial]\n| data-sort-value=\"2017-03-27\"| 23–27 Mar 2017\n| 2,235\n| –\n| style=\"background:#FFED99;\"| 60.5%\n| 39.5%\n|-\n| style=\"background:#FFFFFF;\"| [https://www.slideshare.net/slideshow/embed_code/key/tCIDiAaa3EnoJm Le Terrain]***\n| data-sort-value=\"2017-03-27\"| 23–27 Mar 2017\n| 647\n| –\n| style=\"background:#FFED99;\"| 70%\n| 30%\n|-\n| style=\"background:aquamarine;\"| [https://web.archive.org/web/20170404220730/http://opinionlab.opinion-way.com/dokumenty/Presitrack-synthese-27au31mars.pdf OpinionWay]\n| data-sort-value=\"2017-03-26\"| 24–26 Mar 2017\n| 1,676\n| –\n| style=\"background:#FFED99;\"| 61%\n| 39%\n|-\n| style=\"background:#FFDFCC;\"| [http://www.bva.fr/data/sondage/sondage_fiche/1969/fichier_intentions_de_vote_-_vague_14_-_pop2017_-_25_mars_2017_-_presentationdcc7f.pdf BVA]\n| data-sort-value=\"2017-03-24\"| 22–24 Mar 2017\n| 880\n| –\n| style=\"background:#FFED99;\"| 62%\n| 38%\n|-\n| style=\"background:#FFCCCC;\"| [http://dataviz.ifop.com:8080/IFOP_ROLLING/IFOP_24-03-2017.pdf Ifop-Fiducial]\n| data-sort-value=\"2017-03-24\"| 21–24 Mar 2017\n| 2,225\n| –\n| style=\"background:#FFED99;\"| 61.5%\n| 38.5%\n|-\n| style=\"background:aquamarine;\"| [https://web.archive.org/web/20170325025043/http://opinionlab.opinion-way.com/dokumenty/PresiTRACK-OpinionWay-Orpi-Resultats-de-la-semaine20-24-03.pdf OpinionWay]\n| data-sort-value=\"2017-03-23\"| 21–23 Mar 2017\n| 1,675\n| –\n| style=\"background:#FFED99;\"| 63%\n| 37%\n|-\n| style=\"background:#FFCCCC;\"| [http://dataviz.ifop.com:8080/IFOP_ROLLING/IFOP_23-03-2017.pdf Ifop-Fiducial]\n| data-sort-value=\"2017-03-23\"| 20–23 Mar 2017\n| 2,245\n| –\n| style=\"background:#FFED99;\"| 61.5%\n| 38.5%\n|-\n| style=\"background:GreenYellow;\"| [http://harris-interactive.fr/wp-content/uploads/sites/6/2017/03/Rapport-Intentions-de-vote-election-presidentielle-France-TV.pdf Harris Interactive]\n| data-sort-value=\"2017-03-22\"| 21–22 Mar 2017\n| 6,383\n| –\n| style=\"background:#FFED99;\"| 65%\n| 35%\n|-\n| style=\"background:aquamarine;\"| [https://web.archive.org/web/20170325025043/http://opinionlab.opinion-way.com/dokumenty/PresiTRACK-OpinionWay-Orpi-Resultats-de-la-semaine20-24-03.pdf OpinionWay]\n| data-sort-value=\"2017-03-22\"| 20–22 Mar 2017\n| 1,672\n| –\n| style=\"background:#FFED99;\"| 63%\n| 37%\n|-\n| style=\"background:#FFCCCC;\"| [http://dataviz.ifop.com:8080/IFOP_ROLLING/IFOP_22-03-2017.pdf Ifop-Fiducial]\n| data-sort-value=\"2017-03-22\"| 19–22 Mar 2017\n| 1,974\n| –\n| style=\"background:#FFED99;\"| 61%\n| 39%\n|-\n| style=\"background:#CAD5F7;\"| [https://elabe.fr/wp-content/uploads/2017/03/21032017_bfmtv_lexpress_intentions-de-vote-presidentielles-vague-5-1.pdf Elabe]\n| data-sort-value=\"2017-03-21\"| 21 Mar 2017\n| 997\n| –\n| style=\"background:#FFED99;\"| 64%\n| 36%\n|-\n| style=\"background:aquamarine;\"| [https://web.archive.org/web/20170325025043/http://opinionlab.opinion-way.com/dokumenty/PresiTRACK-OpinionWay-Orpi-Resultats-de-la-semaine20-24-03.pdf OpinionWay]\n| data-sort-value=\"2017-03-21\"| 19–21 Mar 2017\n| 1,676\n| –\n| style=\"background:#FFED99;\"| 62%\n| 38%\n|-\n| style=\"background:#FFCCCC;\"| [http://dataviz.ifop.com:8080/IFOP_ROLLING/IFOP_21-03-2017.pdf Ifop-Fiducial]\n| data-sort-value=\"2017-03-21\"| 18–21 Mar 2017\n| 1,695\n| –\n| style=\"background:#FFED99;\"| 60.5%\n| 39.5%\n|-\n| style=\"background:#FFCCCC;\"| [http://dataviz.ifop.com:8080/IFOP_ROLLING/IFOP_20-03-2017.pdf Ifop-Fiducial]\n| data-sort-value=\"2017-03-20\"| 18–20 Mar 2017\n| 935\n| –\n| style=\"background:#FFED99;\"| 60%\n| 40%\n|-\n| style=\"background:aquamarine;\"| [https://web.archive.org/web/20170325025043/http://opinionlab.opinion-way.com/dokumenty/PresiTRACK-OpinionWay-Orpi-Resultats-de-la-semaine20-24-03.pdf OpinionWay]\n| data-sort-value=\"2017-03-20\"| 18–20 Mar 2017\n| 1,667\n| –\n| style=\"background:#FFED99;\"| 61%\n| 39%\n|-\n| style=\"background:#CAD5F7;\"| [https://elabe.fr/wp-content/uploads/2017/03/20032017_bfmtv_lexpress_intentions-de-vote-presidentielles-vague-4-1.pdf Elabe]\n| data-sort-value=\"2017-03-19\"| 17–19 Mar 2017\n| 2,847\n| –\n| style=\"background:#FFED99;\"| 63%\n| 37%\n|-\n| style=\"background:aquamarine;\"| [https://web.archive.org/web/20170325025043/http://opinionlab.opinion-way.com/dokumenty/PresiTRACK-OpinionWay-Orpi-Resultats-de-la-semaine20-24-03.pdf OpinionWay]\n| data-sort-value=\"2017-03-19\"| 17–19 Mar 2017\n| 1,593\n| –\n| style=\"background:#FFED99;\"| 60%\n| 40%\n|-\n| style=\"background:#FFDFCC;\"| [http://www.bva.fr/data/sondage/sondage_fiche/1962/fichier_intentions_de_vote_-_vague_13_-_pop2017_-_18_mars_2017_-_presentationd5dd0.pdf BVA]\n| data-sort-value=\"2017-03-17\"| 15–17 Mar 2017\n| 858\n| –\n| style=\"background:#FFED99;\"| 62%\n| 38%\n|-\n| style=\"background:#FFCCCC;\"| [http://dataviz.ifop.com:8080/IFOP_ROLLING/IFOP_17-03-2017.pdf Ifop-Fiducial]\n| data-sort-value=\"2017-03-17\"| 14–17 Mar 2017\n| 1,376\n| –\n| style=\"background:#FFED99;\"| 61%\n| 39%\n|-\n| style=\"background:#FFCCFF;\"| [http://www.odoxa.fr/wp-content/uploads/2017/03/Odoxa-Dentsu-pour-13h15-Intention-de-Vote-Presidentielle-2.pdf Odoxa]\n| data-sort-value=\"2017-03-16\"| 15–16 Mar 2017\n| 603\n| –\n| style=\"background:#FFED99;\"| 64%\n| 36%\n|-\n| style=\"background:aquamarine;\"| [https://web.archive.org/web/20170318083803/http://opinionlab.opinion-way.com/dokumenty/PresiTRACK-OpinionWay-Orpi-semaine-13-17mars.pdf OpinionWay]\n| data-sort-value=\"2017-03-16\"| 14–16 Mar 2017\n| 1,571\n| –\n| style=\"background:#FFED99;\"| 59%\n| 41%\n|-\n| style=\"background:#FFCCCC;\"| [http://dataviz.ifop.com:8080/IFOP_ROLLING/IFOP_16-03-2017.pdf Ifop-Fiducial]\n| data-sort-value=\"2017-03-16\"| 13–16 Mar 2017\n| 1,386\n| –\n| style=\"background:#FFED99;\"| 61%\n| 39%\n|-\n| style=\"background:#04FBF4;\"| [https://www.ipsos.com/sites/default/files/files-fr-fr/doc_associe/rapport_cevipof-eef2017_vague_12_ipsos_lemonde.pdf Ipsos]\n| data-sort-value=\"2017-03-15\"| 14–15 Mar 2017\n| 8,205\n| –\n| style=\"background:#FFED99;\"| 61%\n| 39%\n|-\n| style=\"background:aquamarine;\"| [https://web.archive.org/web/20170318083803/http://opinionlab.opinion-way.com/dokumenty/PresiTRACK-OpinionWay-Orpi-semaine-13-17mars.pdf OpinionWay]\n| data-sort-value=\"2017-03-15\"| 13–15 Mar 2017\n| 1,554\n| –\n| style=\"background:#FFED99;\"| 60%\n| 40%\n|-\n| style=\"background:#FFCCCC;\"| [http://dataviz.ifop.com:8080/IFOP_ROLLING/IFOP_15-03-2017.pdf Ifop-Fiducial]\n| data-sort-value=\"2017-03-15\"| 12–15 Mar 2017\n| 1,399\n| –\n| style=\"background:#FFED99;\"| 61.5%\n| 38.5%\n|-\n| style=\"background:aquamarine;\"| [https://web.archive.org/web/20170318083803/http://opinionlab.opinion-way.com/dokumenty/PresiTRACK-OpinionWay-Orpi-semaine-13-17mars.pdf OpinionWay]\n| data-sort-value=\"2017-03-14\"| 12–14 Mar 2017\n| 1,529\n| –\n| style=\"background:#FFED99;\"| 61%\n| 39%\n|-\n| style=\"background:#FFCCCC;\"| [http://dataviz.ifop.com:8080/IFOP_ROLLING/IFOP_14-03-2017.pdf Ifop-Fiducial]\n| data-sort-value=\"2017-03-14\"| 10–14 Mar 2017\n| 1,413\n| –\n| style=\"background:#FFED99;\"| 60.5%\n| 39.5%\n|-\n| style=\"background:aquamarine;\"| [https://web.archive.org/web/20170318083803/http://opinionlab.opinion-way.com/dokumenty/PresiTRACK-OpinionWay-Orpi-semaine-13-17mars.pdf OpinionWay]\n| data-sort-value=\"2017-03-13\"| 11–13 Mar 2017\n| 1,528\n| –\n| style=\"background:#FFED99;\"| 60%\n| 40%\n|-\n| style=\"background:#FFFFFF;\"| [http://www.commission-des-sondages.fr/notices/files/notices/2017/mars/8306-pres-future-thinking-womensports.pdf Future Thinking]\n| data-sort-value=\"2017-03-13\"| 10–13 Mar 2017\n| 717\n| –\n| style=\"background:#FFED99;\"| 59.5%\n| 40.5%\n|-\n| style=\"background:#FFCCCC;\"| [http://dataviz.ifop.com:8080/IFOP_ROLLING/IFOP_13-03-2017.pdf Ifop-Fiducial]\n| data-sort-value=\"2017-03-13\"| 9–13 Mar 2017\n| 1,397\n| –\n| style=\"background:#FFED99;\"| 60.5%\n| 39.5%\n|-\n| style=\"background:aquamarine;\"| [https://web.archive.org/web/20170318083803/http://opinionlab.opinion-way.com/dokumenty/PresiTRACK-OpinionWay-Orpi-semaine-13-17mars.pdf OpinionWay]\n| data-sort-value=\"2017-03-12\"| 10–12 Mar 2017\n| 1,610\n| –\n| style=\"background:#FFED99;\"| 62%\n| 38%\n|-\n| style=\"background:#FFDFCC;\"| [http://www.bva.fr/data/sondage/sondage_fiche/1960/fichier_intentions_de_vote_-_vague_12_-_pop2017_-_11_mars_2017_-_presentation395b5.pdf BVA]\n| data-sort-value=\"2017-03-10\"| 8–10 Mar 2017\n| 839\n| –\n| style=\"background:#FFED99;\"| 61%\n| 39%\n|-\n| style=\"background:#FFCCCC;\"| [http://dataviz.ifop.com:8080/IFOP_ROLLING/IFOP_10-03-2017.pdf Ifop-Fiducial]\n| data-sort-value=\"2017-03-10\"| 7–10 Mar 2017\n| 1,379\n| –\n| style=\"background:#FFED99;\"| 60.5%\n| 39.5%\n|-\n| style=\"background:aquamarine;\"| [https://web.archive.org/web/20170312070248/http://opinionlab.opinion-way.com/dokumenty/PresiTRACK-06au10-03.pdf OpinionWay]\n| data-sort-value=\"2017-03-09\"| 7–9 Mar 2017\n| 1,571\n| –\n| style=\"background:#FFED99;\"| 65%\n| 35%\n|-\n| style=\"background:#FFCCCC;\"| [http://dataviz.ifop.com:8080/IFOP_ROLLING/IFOP_09-03-2017.pdf Ifop-Fiducial]\n| data-sort-value=\"2017-03-09\"| 6–9 Mar 2017\n| 1,395\n| –\n| style=\"background:#FFED99;\"| 60.5%\n| 39.5%\n|-\n| style=\"background:GreenYellow;\"| [http://harris-interactive.fr/wp-content/uploads/sites/6/2017/03/Rapport-Harris-Intentions-vote-election-presidentielle-France-TV-2.pdf Harris Interactive]\n| data-sort-value=\"2017-03-08\"| 6–8 Mar 2017\n| 4,533\n| –\n| style=\"background:#FFED99;\"| 65%\n| 35%\n|-\n| style=\"background:aquamarine;\"| [https://web.archive.org/web/20170312070248/http://opinionlab.opinion-way.com/dokumenty/PresiTRACK-06au10-03.pdf OpinionWay]\n| data-sort-value=\"2017-03-08\"| 6–8 Mar 2017\n| 1,509\n| –\n| style=\"background:#FFED99;\"| 64%\n| 36%\n|-\n| style=\"background:#FFCCCC;\"| [http://dataviz.ifop.com:8080/IFOP_ROLLING/IFOP_08-03-2017.pdf Ifop-Fiducial]\n| data-sort-value=\"2017-03-08\"| 5–8 Mar 2017\n| 1,394\n| –\n| style=\"background:#FFED99;\"| 60.5%\n| 39.5%\n|-\n| style=\"background:aquamarine;\"| [https://web.archive.org/web/20170312070248/http://opinionlab.opinion-way.com/dokumenty/PresiTRACK-06au10-03.pdf OpinionWay]\n| data-sort-value=\"2017-03-07\"| 5–7 Mar 2017\n| 1,574\n| –\n| style=\"background:#FFED99;\"| 62%\n| 38%\n|-\n| style=\"background:#FFCCCC;\"| [http://dataviz.ifop.com:8080/IFOP_ROLLING/IFOP_07-03-2017.pdf Ifop-Fiducial]\n| data-sort-value=\"2017-03-07\"| 3–7 Mar 2017\n| 1,390\n| –\n| style=\"background:#FFED99;\"| 61.5%\n| 38.5%\n|-\n| style=\"background:#CAD5F7;\"| [https://elabe.fr/wp-content/uploads/2017/03/07032017_bfmtv_lexpress_intentions-de-vote-presidentielles-vague-3-1.pdf Elabe]\n| data-sort-value=\"2017-03-06\"| 5–6 Mar 2017\n| 1,000\n| –\n| style=\"background:#FFED99;\"| 60%\n| 40%\n|-\n| style=\"background:aquamarine;\"| [https://web.archive.org/web/20170312070248/http://opinionlab.opinion-way.com/dokumenty/PresiTRACK-06au10-03.pdf OpinionWay]\n| data-sort-value=\"2017-03-06\"| 4–6 Mar 2017\n| 1,559\n| –\n| style=\"background:#FFED99;\"| 60%\n| 40%\n|-\n| style=\"background:#FFCCCC;\"| [http://dataviz.ifop.com:8080/IFOP_ROLLING/IFOP_06-03-2017.pdf Ifop-Fiducial]\n| data-sort-value=\"2017-03-06\"| 2–6 Mar 2017\n| 1,381\n| –\n| style=\"background:#FFED99;\"| 61%\n| 39%\n|-\n| style=\"background:aquamarine;\"| [https://web.archive.org/web/20170312070248/http://opinionlab.opinion-way.com/dokumenty/PresiTRACK-06au10-03.pdf OpinionWay]\n| data-sort-value=\"2017-03-05\"| 3–5 Mar 2017\n| 1,671\n| –\n| style=\"background:#FFED99;\"| 60%\n| 40%\n|-\n| style=\"background:#04FBF4;\"| [https://www.ipsos.com/sites/default/files/files-fr-fr/doc_associe/rapport_cevipof_fjj_-_eef2017_vague_mars_ipsos_lemonde_-_publication.pdf Ipsos]\n| data-sort-value=\"2017-03-05\"| 1–5 Mar 2017\n| 10,854\n| –\n| style=\"background:#FFED99;\"| 62%\n| 38%\n|-\n| style=\"background:#FFCCCC;\"| [https://www.ifop.com/wp-content/uploads/2018/03/3677-1-study_file.pdf Ifop-Fiducial]*\n| data-sort-value=\"2017-03-04\"| 2–4 Mar 2017\n| 1,822\n| –\n| style=\"background:#FFED99;\"| 61%\n| 39%\n|-\n| style=\"background:#FFCCCC;\"| [http://dataviz.ifop.com:8080/IFOP_ROLLING/IFOP_03-03-2017.pdf Ifop-Fiducial]\n| data-sort-value=\"2017-03-03\"| 28 Feb–3 Mar 2017\n| 1,383\n| –\n| style=\"background:#FFED99;\"| 61%\n| 39%\n|-\n| style=\"background:#FFDFCC;\"| [http://www.bva.fr/data/sondage/sondage_fiche/1955/fichier_intentions_de_vote_-_vague_11_-_pop2017_-_4_mars_2017_-_presentation33d6b.pdf BVA]\n| data-sort-value=\"2017-03-02\"| 28 Feb–2 Mar 2017\n| 855\n| –\n| style=\"background:#FFED99;\"| 62%\n| 38%\n|-\n| style=\"background:#CAD5F7;\"| [https://elabe.fr/wp-content/uploads/2017/03/02032017_les_echos_radio_classique_intentions-de-vote-presidentielles-vague-7.pdf Elabe]\n| data-sort-value=\"2017-03-02\"| 28 Feb–2 Mar 2017\n| 1,507\n| –\n| style=\"background:#FFED99;\"| 62%\n| 38%\n|-\n| style=\"background:aquamarine;\"| [https://web.archive.org/web/20170307022801/http://opinionlab.opinion-way.com/dokumenty/PresiTRACK-27-02au03-03.pdf OpinionWay]\n| data-sort-value=\"2017-03-02\"| 28 Feb–2 Mar 2017\n| 1,654\n| –\n| style=\"background:#FFED99;\"| 62%\n| 38%\n|-\n| style=\"background:#FFCCCC;\"| [http://dataviz.ifop.com:8080/IFOP_ROLLING/IFOP_02-03-2017.pdf Ifop-Fiducial]\n| data-sort-value=\"2017-03-02\"| 27 Feb–2 Mar 2017\n| 1,394\n| –\n| style=\"background:#FFED99;\"| 61%\n| 39%\n|-\n| style=\"background:aquamarine;\"| [https://web.archive.org/web/20170307022801/http://opinionlab.opinion-way.com/dokumenty/PresiTRACK-27-02au03-03.pdf OpinionWay]\n| data-sort-value=\"2017-03-01\"| 27 Feb–1 Mar 2017\n| 1,639\n| –\n| style=\"background:#FFED99;\"| 63%\n| 37%\n|-\n| style=\"background:#FFCCCC;\"| [http://dataviz.ifop.com:8080/IFOP_ROLLING/IFOP_01-03-2017.pdf Ifop-Fiducial]\n| data-sort-value=\"2017-03-01\"| 26 Feb–1 Mar 2017\n| 1,392\n| –\n| style=\"background:#FFED99;\"| 62%\n| 38%\n|-\n| style=\"background:aquamarine;\"| [https://web.archive.org/web/20170307022801/http://opinionlab.opinion-way.com/dokumenty/PresiTRACK-27-02au03-03.pdf OpinionWay]\n| data-sort-value=\"2017-02-28\"| 26–28 Feb 2017\n| 1,629\n| –\n| style=\"background:#FFED99;\"| 63%\n| 37%\n|-\n| style=\"background:#FFCCCC;\"| [http://dataviz.ifop.com:8080/IFOP_ROLLING/IFOP_28-02-2017.pdf Ifop-Fiducial]\n| data-sort-value=\"2017-02-28\"| 24–28 Feb 2017\n| 1,398\n| –\n| st